root@lamp-s-1vcpu-1gb-nyc1-01:~# tcpdump -n -i eth0
tcpdump: verbose output suppressed, use -v or -vv for full protocol decode
listening on eth0, link-type EN10MB (Ethernet), capture size 262144 bytes
20:38:17.039289 IP 157.245.94.33.22 > 198.96.85.163.26087: Flags [P.], seq 3982420899:3982421007, ack 643417622, win 313, length 108
20:38:17.039375 IP 157.245.94.33.22 > 198.96.85.163.26087: Flags [P.], seq 108:144, ack 1, win 313, length 36
20:38:17.039453 IP 157.245.94.33.22 > 198.96.85.163.26087: Flags [P.], seq 144:252, ack 1, win 313, length 108
20:38:17.039516 IP 157.245.94.33.22 > 198.96.85.163.26087: Flags [P.], seq 252:288, ack 1, win 313, length 36
20:38:17.039679 IP 157.245.94.33.22 > 198.96.85.163.26087: Flags [P.], seq 288:460, ack 1, win 313, length 172
20:38:17.039747 IP 157.245.94.33.22 > 198.96.85.163.26087: Flags [P.], seq 460:496, ack 1, win 313, length 36
20:38:17.039832 IP 157.245.94.33.22 > 198.96.85.163.26087: Flags [P.], seq 496:644, ack 1, win 313, length 148
20:38:17.039894 IP 157.245.94.33.22 > 198.96.85.163.26087: Flags [P.], seq 644:680, ack 1, win 313, length 36
20:38:17.039970 IP 157.245.94.33.22 > 198.96.85.163.26087: Flags [P.], seq 680:828, ack 1, win 313, length 148
20:38:17.059837 IP 198.96.85.163.26087 > 157.245.94.33.22: Flags [.], ack 828, win 2047, length 0
20:38:17.059917 IP 157.245.94.33.22 > 198.96.85.163.26087: Flags [P.], seq 828:1968, ack 1, win 313, length 1140
20:38:17.060143 IP 157.245.94.33.22 > 198.96.85.163.26087: Flags [P.], seq 1968:2100, ack 1, win 313, length 132
20:38:17.060241 IP 157.245.94.33.22 > 198.96.85.163.26087: Flags [P.], seq 2100:2136, ack 1, win 313, length 36
20:38:17.060348 IP 157.245.94.33.22 > 198.96.85.163.26087: Flags [P.], seq 2136:2284, ack 1, win 313, length 148
20:38:17.060415 IP 157.245.94.33.22 > 198.96.85.163.26087: Flags [P.], seq 2284:2320, ack 1, win 313, length 36
20:38:17.060505 IP 157.245.94.33.22 > 198.96.85.163.26087: Flags [P.], seq 2320:2468, ack 1, win 313, length 148
20:38:17.060574 IP 157.245.94.33.22 > 198.96.85.163.26087: Flags [P.], seq 2468:2504, ack 1, win 313, length 36
20:38:17.060660 IP 157.245.94.33.22 > 198.96.85.163.26087: Flags [P.], seq 2504:2652, ack 1, win 313, length 148
20:38:17.060724 IP 157.245.94.33.22 > 198.96.85.163.26087: Flags [P.], seq 2652:2688, ack 1, win 313, length 36
20:38:17.060808 IP 157.245.94.33.22 > 198.96.85.163.26087: Flags [P.], seq 2688:2836, ack 1, win 313, length 148
20:38:17.060963 IP 157.245.94.33.22 > 198.96.85.163.26087: Flags [P.], seq 2872:3020, ack 1, win 313, length 148
20:38:17.061169 IP 157.245.94.33.22 > 198.96.85.163.26087: Flags [P.], seq 3056:3204, ack 1, win 313, length 148
20:38:17.061403 IP 157.245.94.33.22 > 198.96.85.163.26087: Flags [P.], seq 3240:3388, ack 1, win 313, length 148
20:38:17.061601 IP 157.245.94.33.22 > 198.96.85.163.26087: Flags [P.], seq 3424:3572, ack 1, win 313, length 148
20:38:17.061787 IP 157.245.94.33.22 > 198.96.85.163.26087: Flags [P.], seq 3608:3756, ack 1, win 313, length 148
20:38:17.081675 IP 198.96.85.163.26087 > 157.245.94.33.22: Flags [.], ack 3756, win 2051, length 0
20:38:17.081755 IP 157.245.94.33.22 > 198.96.85.163.26087: Flags [P.], seq 3756:4896, ack 1, win 313, length 1140
20:38:17.081995 IP 157.245.94.33.22 > 198.96.85.163.26087: Flags [P.], seq 4896:5028, ack 1, win 313, length 132
20:38:17.082130 IP 157.245.94.33.22 > 198.96.85.163.26087: Flags [P.], seq 5028:5064, ack 1, win 313, length 36
20:38:17.082282 IP 157.245.94.33.22 > 198.96.85.163.26087: Flags [P.], seq 5064:5212, ack 1, win 313, length 148
20:38:17.082348 IP 157.245.94.33.22 > 198.96.85.163.26087: Flags [P.], seq 5212:5248, ack 1, win 313, length 36
20:38:17.082429 IP 157.245.94.33.22 > 198.96.85.163.26087: Flags [P.], seq 5248:5396, ack 1, win 313, length 148
20:38:17.082525 IP 157.245.94.33.22 > 198.96.85.163.26087: Flags [P.], seq 5396:5432, ack 1, win 313, length 36
20:38:17.082637 IP 157.245.94.33.22 > 198.96.85.163.26087: Flags [P.], seq 5432:5580, ack 1, win 313, length 148
20:38:17.082699 IP 157.245.94.33.22 > 198.96.85.163.26087: Flags [P.], seq 5580:5616, ack 1, win 313, length 36
20:38:17.082775 IP 157.245.94.33.22 > 198.96.85.163.26087: Flags [P.], seq 5616:5764, ack 1, win 313, length 148
20:38:17.082906 IP 157.245.94.33.22 > 198.96.85.163.26087: Flags [P.], seq 5800:5948, ack 1, win 313, length 148
20:38:17.083039 IP 157.245.94.33.22 > 198.96.85.163.26087: Flags [P.], seq 5984:6132, ack 1, win 313, length 148
20:38:17.083301 IP 157.245.94.33.22 > 198.96.85.163.26087: Flags [P.], seq 6168:6316, ack 1, win 313, length 148
20:38:17.083490 IP 157.245.94.33.22 > 198.96.85.163.26087: Flags [P.], seq 6352:6500, ack 1, win 313, length 148
20:38:17.083674 IP 157.245.94.33.22 > 198.96.85.163.26087: Flags [P.], seq 6536:6684, ack 1, win 313, length 148
20:38:17.083805 IP 157.245.94.33.22 > 198.96.85.163.26087: Flags [P.], seq 6720:6868, ack 1, win 313, length 148
20:38:17.083932 IP 157.245.94.33.22 > 198.96.85.163.26087: Flags [P.], seq 6904:7052, ack 1, win 313, length 148
20:38:17.084150 IP 157.245.94.33.22 > 198.96.85.163.26087: Flags [P.], seq 7088:7236, ack 1, win 313, length 148
20:38:17.084364 IP 157.245.94.33.22 > 198.96.85.163.26087: Flags [P.], seq 7236:7960, ack 1, win 313, length 724
20:38:17.084473 IP 157.245.94.33.22 > 198.96.85.163.26087: Flags [P.], seq 7960:8108, ack 1, win 313, length 148
20:38:17.084614 IP 157.245.94.33.22 > 198.96.85.163.26087: Flags [P.], seq 8108:8256, ack 1, win 313, length 148
20:38:17.084706 IP 157.245.94.33.22 > 198.96.85.163.26087: Flags [P.], seq 8256:8404, ack 1, win 313, length 148
20:38:17.084790 IP 157.245.94.33.22 > 198.96.85.163.26087: Flags [P.], seq 8404:8552, ack 1, win 313, length 148
20:38:17.084872 IP 157.245.94.33.22 > 198.96.85.163.26087: Flags [P.], seq 8552:8700, ack 1, win 313, length 148
20:38:17.084953 IP 157.245.94.33.22 > 198.96.85.163.26087: Flags [P.], seq 8700:8848, ack 1, win 313, length 148
20:38:17.085043 IP 157.245.94.33.22 > 198.96.85.163.26087: Flags [P.], seq 8848:8996, ack 1, win 313, length 148
20:38:17.085125 IP 157.245.94.33.22 > 198.96.85.163.26087: Flags [P.], seq 8996:9144, ack 1, win 313, length 148
20:38:17.085237 IP 157.245.94.33.22 > 198.96.85.163.26087: Flags [P.], seq 9144:9292, ack 1, win 313, length 148
20:38:17.085325 IP 157.245.94.33.22 > 198.96.85.163.26087: Flags [P.], seq 9292:9440, ack 1, win 313, length 148
20:38:17.085461 IP 157.245.94.33.22 > 198.96.85.163.26087: Flags [P.], seq 9440:9588, ack 1, win 313, length 148
20:38:17.085594 IP 157.245.94.33.22 > 198.96.85.163.26087: Flags [P.], seq 9588:9736, ack 1, win 313, length 148
20:38:17.085759 IP 157.245.94.33.22 > 198.96.85.163.26087: Flags [P.], seq 9736:9884, ack 1, win 313, length 148
20:38:17.105752 IP 198.96.85.163.26087 > 157.245.94.33.22: Flags [.], ack 7236, win 2051, length 0
20:38:17.105829 IP 157.245.94.33.22 > 198.96.85.163.26087: Flags [P.], seq 9884:10032, ack 1, win 313, length 148
20:38:17.106072 IP 157.245.94.33.22 > 198.96.85.163.26087: Flags [P.], seq 10032:10284, ack 1, win 313, length 252
20:38:17.106225 IP 157.245.94.33.22 > 198.96.85.163.26087: Flags [P.], seq 10284:10440, ack 1, win 313, length 156
20:38:17.106306 IP 198.96.85.163.26087 > 157.245.94.33.22: Flags [.], ack 8256, win 2047, length 0
20:38:17.106414 IP 157.245.94.33.22 > 198.96.85.163.26087: Flags [P.], seq 10440:10692, ack 1, win 313, length 252
20:38:17.106526 IP 157.245.94.33.22 > 198.96.85.163.26087: Flags [P.], seq 10692:10848, ack 1, win 313, length 156
20:38:17.106625 IP 157.245.94.33.22 > 198.96.85.163.26087: Flags [P.], seq 10848:11004, ack 1, win 313, length 156
20:38:17.106736 IP 157.245.94.33.22 > 198.96.85.163.26087: Flags [P.], seq 11004:11160, ack 1, win 313, length 156
20:38:17.106837 IP 157.245.94.33.22 > 198.96.85.163.26087: Flags [P.], seq 11160:11316, ack 1, win 313, length 156
20:38:17.106928 IP 157.245.94.33.22 > 198.96.85.163.26087: Flags [P.], seq 11316:11472, ack 1, win 313, length 156
20:38:17.107025 IP 157.245.94.33.22 > 198.96.85.163.26087: Flags [P.], seq 11472:11628, ack 1, win 313, length 156
20:38:17.107127 IP 157.245.94.33.22 > 198.96.85.163.26087: Flags [P.], seq 11628:11784, ack 1, win 313, length 156
20:38:17.107225 IP 157.245.94.33.22 > 198.96.85.163.26087: Flags [P.], seq 11784:11940, ack 1, win 313, length 156
20:38:17.107322 IP 157.245.94.33.22 > 198.96.85.163.26087: Flags [P.], seq 11940:12096, ack 1, win 313, length 156
20:38:17.107451 IP 157.245.94.33.22 > 198.96.85.163.26087: Flags [P.], seq 12096:12252, ack 1, win 313, length 156
20:38:17.107549 IP 157.245.94.33.22 > 198.96.85.163.26087: Flags [P.], seq 12252:12408, ack 1, win 313, length 156
20:38:17.107651 IP 157.245.94.33.22 > 198.96.85.163.26087: Flags [P.], seq 12408:12564, ack 1, win 313, length 156
20:38:17.107751 IP 157.245.94.33.22 > 198.96.85.163.26087: Flags [P.], seq 12564:12720, ack 1, win 313, length 156
20:38:17.107877 IP 157.245.94.33.22 > 198.96.85.163.26087: Flags [P.], seq 12720:12876, ack 1, win 313, length 156
20:38:17.107971 IP 157.245.94.33.22 > 198.96.85.163.26087: Flags [P.], seq 12876:13032, ack 1, win 313, length 156
20:38:17.108064 IP 157.245.94.33.22 > 198.96.85.163.26087: Flags [P.], seq 13032:13188, ack 1, win 313, length 156
20:38:17.108164 IP 157.245.94.33.22 > 198.96.85.163.26087: Flags [P.], seq 13188:13344, ack 1, win 313, length 156
20:38:17.108256 IP 157.245.94.33.22 > 198.96.85.163.26087: Flags [P.], seq 13344:13500, ack 1, win 313, length 156
20:38:17.108348 IP 157.245.94.33.22 > 198.96.85.163.26087: Flags [P.], seq 13500:13656, ack 1, win 313, length 156
20:38:17.108441 IP 157.245.94.33.22 > 198.96.85.163.26087: Flags [P.], seq 13656:13812, ack 1, win 313, length 156
20:38:17.108534 IP 157.245.94.33.22 > 198.96.85.163.26087: Flags [P.], seq 13812:13968, ack 1, win 313, length 156
20:38:17.108587 IP 198.96.85.163.26087 > 157.245.94.33.22: Flags [.], ack 9884, win 2051, length 0
20:38:17.108698 IP 157.245.94.33.22 > 198.96.85.163.26087: Flags [P.], seq 13968:14220, ack 1, win 313, length 252
20:38:17.108801 IP 157.245.94.33.22 > 198.96.85.163.26087: Flags [P.], seq 14220:14376, ack 1, win 313, length 156
20:38:17.108900 IP 157.245.94.33.22 > 198.96.85.163.26087: Flags [P.], seq 14376:14532, ack 1, win 313, length 156
20:38:17.109002 IP 157.245.94.33.22 > 198.96.85.163.26087: Flags [P.], seq 14532:14688, ack 1, win 313, length 156
20:38:17.109127 IP 157.245.94.33.22 > 198.96.85.163.26087: Flags [P.], seq 14688:14844, ack 1, win 313, length 156
20:38:17.109252 IP 157.245.94.33.22 > 198.96.85.163.26087: Flags [P.], seq 14844:15000, ack 1, win 313, length 156
20:38:17.109350 IP 157.245.94.33.22 > 198.96.85.163.26087: Flags [P.], seq 15000:15156, ack 1, win 313, length 156
20:38:17.109445 IP 157.245.94.33.22 > 198.96.85.163.26087: Flags [P.], seq 15156:15312, ack 1, win 313, length 156
20:38:17.109546 IP 157.245.94.33.22 > 198.96.85.163.26087: Flags [P.], seq 15312:15468, ack 1, win 313, length 156
20:38:17.109631 IP 157.245.94.33.22 > 198.96.85.163.26087: Flags [P.], seq 15468:15624, ack 1, win 313, length 156
20:38:17.109714 IP 157.245.94.33.22 > 198.96.85.163.26087: Flags [P.], seq 15624:15780, ack 1, win 313, length 156
20:38:17.109802 IP 157.245.94.33.22 > 198.96.85.163.26087: Flags [P.], seq 15780:15936, ack 1, win 313, length 156
20:38:17.109886 IP 157.245.94.33.22 > 198.96.85.163.26087: Flags [P.], seq 15936:16092, ack 1, win 313, length 156
20:38:17.109977 IP 157.245.94.33.22 > 198.96.85.163.26087: Flags [P.], seq 16092:16248, ack 1, win 313, length 156
20:38:17.110066 IP 157.245.94.33.22 > 198.96.85.163.26087: Flags [P.], seq 16248:16404, ack 1, win 313, length 156
20:38:17.110147 IP 157.245.94.33.22 > 198.96.85.163.26087: Flags [P.], seq 16404:16560, ack 1, win 313, length 156
20:38:17.110269 IP 157.245.94.33.22 > 198.96.85.163.26087: Flags [P.], seq 16560:16716, ack 1, win 313, length 156
20:38:17.110396 IP 157.245.94.33.22 > 198.96.85.163.26087: Flags [P.], seq 16716:16872, ack 1, win 313, length 156
20:38:17.110509 IP 157.245.94.33.22 > 198.96.85.163.26087: Flags [P.], seq 16872:17028, ack 1, win 313, length 156
20:38:17.110608 IP 157.245.94.33.22 > 198.96.85.163.26087: Flags [P.], seq 17028:17184, ack 1, win 313, length 156
20:38:17.110722 IP 157.245.94.33.22 > 198.96.85.163.26087: Flags [P.], seq 17184:17340, ack 1, win 313, length 156
20:38:17.110863 IP 157.245.94.33.22 > 198.96.85.163.26087: Flags [P.], seq 17340:17496, ack 1, win 313, length 156
20:38:17.110985 IP 157.245.94.33.22 > 198.96.85.163.26087: Flags [P.], seq 17496:17652, ack 1, win 313, length 156
20:38:17.111066 IP 157.245.94.33.22 > 198.96.85.163.26087: Flags [P.], seq 17652:17808, ack 1, win 313, length 156
20:38:17.111167 IP 157.245.94.33.22 > 198.96.85.163.26087: Flags [P.], seq 17808:17964, ack 1, win 313, length 156
20:38:17.111312 IP 157.245.94.33.22 > 198.96.85.163.26087: Flags [P.], seq 17964:18120, ack 1, win 313, length 156
20:38:17.111460 IP 157.245.94.33.22 > 198.96.85.163.26087: Flags [P.], seq 18120:18276, ack 1, win 313, length 156
20:38:17.111556 IP 157.245.94.33.22 > 198.96.85.163.26087: Flags [P.], seq 18276:18432, ack 1, win 313, length 156
20:38:17.111642 IP 157.245.94.33.22 > 198.96.85.163.26087: Flags [P.], seq 18432:18588, ack 1, win 313, length 156
20:38:17.111776 IP 157.245.94.33.22 > 198.96.85.163.26087: Flags [P.], seq 18588:18744, ack 1, win 313, length 156
20:38:17.111907 IP 157.245.94.33.22 > 198.96.85.163.26087: Flags [P.], seq 18744:18900, ack 1, win 313, length 156
20:38:17.112026 IP 157.245.94.33.22 > 198.96.85.163.26087: Flags [P.], seq 18900:19056, ack 1, win 313, length 156
20:38:17.112124 IP 157.245.94.33.22 > 198.96.85.163.26087: Flags [P.], seq 19056:19212, ack 1, win 313, length 156
20:38:17.112246 IP 157.245.94.33.22 > 198.96.85.163.26087: Flags [P.], seq 19212:19368, ack 1, win 313, length 156
20:38:17.112350 IP 157.245.94.33.22 > 198.96.85.163.26087: Flags [P.], seq 19368:19524, ack 1, win 313, length 156
20:38:17.112438 IP 157.245.94.33.22 > 198.96.85.163.26087: Flags [P.], seq 19524:19680, ack 1, win 313, length 156
20:38:17.112523 IP 157.245.94.33.22 > 198.96.85.163.26087: Flags [P.], seq 19680:19836, ack 1, win 313, length 156
20:38:17.112619 IP 157.245.94.33.22 > 198.96.85.163.26087: Flags [P.], seq 19836:19992, ack 1, win 313, length 156
20:38:17.112707 IP 157.245.94.33.22 > 198.96.85.163.26087: Flags [P.], seq 19992:20148, ack 1, win 313, length 156
20:38:17.112820 IP 157.245.94.33.22 > 198.96.85.163.26087: Flags [P.], seq 20148:20304, ack 1, win 313, length 156
20:38:17.112900 IP 157.245.94.33.22 > 198.96.85.163.26087: Flags [P.], seq 20304:20460, ack 1, win 313, length 156
20:38:17.113018 IP 157.245.94.33.22 > 198.96.85.163.26087: Flags [P.], seq 20460:20616, ack 1, win 313, length 156
20:38:17.113156 IP 157.245.94.33.22 > 198.96.85.163.26087: Flags [P.], seq 20616:20772, ack 1, win 313, length 156
20:38:17.113292 IP 157.245.94.33.22 > 198.96.85.163.26087: Flags [P.], seq 20772:20928, ack 1, win 313, length 156
20:38:17.113375 IP 157.245.94.33.22 > 198.96.85.163.26087: Flags [P.], seq 20928:21084, ack 1, win 313, length 156
20:38:17.113448 IP 157.245.94.33.22 > 198.96.85.163.26087: Flags [P.], seq 21084:21240, ack 1, win 313, length 156
20:38:17.113523 IP 157.245.94.33.22 > 198.96.85.163.26087: Flags [P.], seq 21240:21396, ack 1, win 313, length 156
20:38:17.113598 IP 157.245.94.33.22 > 198.96.85.163.26087: Flags [P.], seq 21396:21552, ack 1, win 313, length 156
20:38:17.113673 IP 157.245.94.33.22 > 198.96.85.163.26087: Flags [P.], seq 21552:21708, ack 1, win 313, length 156
20:38:17.113749 IP 157.245.94.33.22 > 198.96.85.163.26087: Flags [P.], seq 21708:21864, ack 1, win 313, length 156
20:38:17.113821 IP 157.245.94.33.22 > 198.96.85.163.26087: Flags [P.], seq 21864:22020, ack 1, win 313, length 156
20:38:17.132074 IP 198.96.85.163.26087 > 157.245.94.33.22: Flags [.], ack 14376, win 2051, length 0
20:38:17.132183 IP 157.245.94.33.22 > 198.96.85.163.26087: Flags [P.], seq 22020:22176, ack 1, win 313, length 156
20:38:17.132274 IP 198.96.85.163.26087 > 157.245.94.33.22: Flags [.], ack 17964, win 2051, length 0
20:38:17.132354 IP 198.96.85.163.26087 > 157.245.94.33.22: Flags [.], ack 19368, win 2051, length 0
20:38:17.132630 IP 157.245.94.33.22 > 198.96.85.163.26087: Flags [P.], seq 22176:22636, ack 1, win 313, length 460
20:38:17.132781 IP 157.245.94.33.22 > 198.96.85.163.26087: Flags [P.], seq 22636:22792, ack 1, win 313, length 156
20:38:17.132843 IP 198.96.85.163.26087 > 157.245.94.33.22: Flags [P.], seq 1:37, ack 19368, win 2051, length 36
20:38:17.132985 IP 157.245.94.33.22 > 198.96.85.163.26087: Flags [P.], seq 22792:23060, ack 37, win 313, length 268
20:38:17.133129 IP 157.245.94.33.22 > 198.96.85.163.26087: Flags [P.], seq 23060:23216, ack 37, win 313, length 156
20:38:17.133290 IP 157.245.94.33.22 > 198.96.85.163.26087: Flags [P.], seq 23216:23372, ack 37, win 313, length 156
20:38:17.133417 IP 157.245.94.33.22 > 198.96.85.163.26087: Flags [P.], seq 23372:23528, ack 37, win 313, length 156
20:38:17.133538 IP 157.245.94.33.22 > 198.96.85.163.26087: Flags [P.], seq 23528:23684, ack 37, win 313, length 156
20:38:17.133660 IP 157.245.94.33.22 > 198.96.85.163.26087: Flags [P.], seq 23684:23840, ack 37, win 313, length 156
20:38:17.133778 IP 157.245.94.33.22 > 198.96.85.163.26087: Flags [P.], seq 23840:23996, ack 37, win 313, length 156
20:38:17.133902 IP 157.245.94.33.22 > 198.96.85.163.26087: Flags [P.], seq 23996:24152, ack 37, win 313, length 156
20:38:17.134025 IP 157.245.94.33.22 > 198.96.85.163.26087: Flags [P.], seq 24152:24308, ack 37, win 313, length 156
20:38:17.134152 IP 157.245.94.33.22 > 198.96.85.163.26087: Flags [P.], seq 24308:24464, ack 37, win 313, length 156
20:38:17.134320 IP 157.245.94.33.22 > 198.96.85.163.26087: Flags [P.], seq 24464:24620, ack 37, win 313, length 156
20:38:17.134447 IP 157.245.94.33.22 > 198.96.85.163.26087: Flags [P.], seq 24620:24776, ack 37, win 313, length 156
20:38:17.134486 IP 198.96.85.163.26087 > 157.245.94.33.22: Flags [.], ack 22020, win 2051, length 0
20:38:17.134645 IP 157.245.94.33.22 > 198.96.85.163.26087: Flags [P.], seq 24776:25028, ack 37, win 313, length 252
20:38:17.134779 IP 157.245.94.33.22 > 198.96.85.163.26087: Flags [P.], seq 25028:25184, ack 37, win 313, length 156
20:38:17.134901 IP 157.245.94.33.22 > 198.96.85.163.26087: Flags [P.], seq 25184:25340, ack 37, win 313, length 156
20:38:17.135026 IP 157.245.94.33.22 > 198.96.85.163.26087: Flags [P.], seq 25340:25496, ack 37, win 313, length 156
20:38:17.135143 IP 157.245.94.33.22 > 198.96.85.163.26087: Flags [P.], seq 25496:25652, ack 37, win 313, length 156
20:38:17.135265 IP 157.245.94.33.22 > 198.96.85.163.26087: Flags [P.], seq 25652:25808, ack 37, win 313, length 156
20:38:17.135392 IP 157.245.94.33.22 > 198.96.85.163.26087: Flags [P.], seq 25808:25964, ack 37, win 313, length 156
20:38:17.135523 IP 157.245.94.33.22 > 198.96.85.163.26087: Flags [P.], seq 25964:26120, ack 37, win 313, length 156
20:38:17.135708 IP 157.245.94.33.22 > 198.96.85.163.26087: Flags [P.], seq 26120:26276, ack 37, win 313, length 156
20:38:17.135851 IP 157.245.94.33.22 > 198.96.85.163.26087: Flags [P.], seq 26276:26432, ack 37, win 313, length 156
20:38:17.135966 IP 157.245.94.33.22 > 198.96.85.163.26087: Flags [P.], seq 26432:26588, ack 37, win 313, length 156
20:38:17.136093 IP 157.245.94.33.22 > 198.96.85.163.26087: Flags [P.], seq 26588:26744, ack 37, win 313, length 156
20:38:17.136219 IP 157.245.94.33.22 > 198.96.85.163.26087: Flags [P.], seq 26744:26900, ack 37, win 313, length 156
20:38:17.136343 IP 157.245.94.33.22 > 198.96.85.163.26087: Flags [P.], seq 26900:27056, ack 37, win 313, length 156
20:38:17.136469 IP 157.245.94.33.22 > 198.96.85.163.26087: Flags [P.], seq 27056:27212, ack 37, win 313, length 156
20:38:17.136594 IP 157.245.94.33.22 > 198.96.85.163.26087: Flags [P.], seq 27212:27368, ack 37, win 313, length 156
20:38:17.136722 IP 157.245.94.33.22 > 198.96.85.163.26087: Flags [P.], seq 27368:27524, ack 37, win 313, length 156
20:38:17.136834 IP 157.245.94.33.22 > 198.96.85.163.26087: Flags [P.], seq 27524:27680, ack 37, win 313, length 156
20:38:17.136958 IP 157.245.94.33.22 > 198.96.85.163.26087: Flags [P.], seq 27680:27836, ack 37, win 313, length 156
20:38:17.137073 IP 157.245.94.33.22 > 198.96.85.163.26087: Flags [P.], seq 27836:27992, ack 37, win 313, length 156
20:38:17.137183 IP 157.245.94.33.22 > 198.96.85.163.26087: Flags [P.], seq 27992:28148, ack 37, win 313, length 156
20:38:17.137329 IP 157.245.94.33.22 > 198.96.85.163.26087: Flags [P.], seq 28148:28304, ack 37, win 313, length 156
20:38:17.137456 IP 157.245.94.33.22 > 198.96.85.163.26087: Flags [P.], seq 28304:28460, ack 37, win 313, length 156
20:38:17.137582 IP 157.245.94.33.22 > 198.96.85.163.26087: Flags [P.], seq 28460:28616, ack 37, win 313, length 156
20:38:17.137703 IP 157.245.94.33.22 > 198.96.85.163.26087: Flags [P.], seq 28616:28772, ack 37, win 313, length 156
20:38:17.137812 IP 157.245.94.33.22 > 198.96.85.163.26087: Flags [P.], seq 28772:28928, ack 37, win 313, length 156
20:38:17.137932 IP 157.245.94.33.22 > 198.96.85.163.26087: Flags [P.], seq 28928:29084, ack 37, win 313, length 156
20:38:17.138062 IP 157.245.94.33.22 > 198.96.85.163.26087: Flags [P.], seq 29084:29240, ack 37, win 313, length 156
20:38:17.138180 IP 157.245.94.33.22 > 198.96.85.163.26087: Flags [P.], seq 29240:29396, ack 37, win 313, length 156
20:38:17.138334 IP 157.245.94.33.22 > 198.96.85.163.26087: Flags [P.], seq 29396:29552, ack 37, win 313, length 156
20:38:17.138468 IP 157.245.94.33.22 > 198.96.85.163.26087: Flags [P.], seq 29552:29708, ack 37, win 313, length 156
20:38:17.138598 IP 157.245.94.33.22 > 198.96.85.163.26087: Flags [P.], seq 29708:29864, ack 37, win 313, length 156
20:38:17.138723 IP 157.245.94.33.22 > 198.96.85.163.26087: Flags [P.], seq 29864:30020, ack 37, win 313, length 156
20:38:17.138924 IP 157.245.94.33.22 > 198.96.85.163.26087: Flags [P.], seq 30020:30176, ack 37, win 313, length 156
20:38:17.139048 IP 157.245.94.33.22 > 198.96.85.163.26087: Flags [P.], seq 30176:30332, ack 37, win 313, length 156
20:38:17.139175 IP 157.245.94.33.22 > 198.96.85.163.26087: Flags [P.], seq 30332:30488, ack 37, win 313, length 156
20:38:17.139292 IP 157.245.94.33.22 > 198.96.85.163.26087: Flags [P.], seq 30488:30644, ack 37, win 313, length 156
20:38:17.139411 IP 157.245.94.33.22 > 198.96.85.163.26087: Flags [P.], seq 30644:30800, ack 37, win 313, length 156
20:38:17.139542 IP 157.245.94.33.22 > 198.96.85.163.26087: Flags [P.], seq 30800:30956, ack 37, win 313, length 156
20:38:17.139672 IP 157.245.94.33.22 > 198.96.85.163.26087: Flags [P.], seq 30956:31112, ack 37, win 313, length 156
20:38:17.139801 IP 157.245.94.33.22 > 198.96.85.163.26087: Flags [P.], seq 31112:31268, ack 37, win 313, length 156
20:38:17.139931 IP 157.245.94.33.22 > 198.96.85.163.26087: Flags [P.], seq 31268:31424, ack 37, win 313, length 156
20:38:17.140067 IP 157.245.94.33.22 > 198.96.85.163.26087: Flags [P.], seq 31424:31580, ack 37, win 313, length 156
20:38:17.140201 IP 157.245.94.33.22 > 198.96.85.163.26087: Flags [P.], seq 31580:31736, ack 37, win 313, length 156
20:38:17.140333 IP 157.245.94.33.22 > 198.96.85.163.26087: Flags [P.], seq 31736:31892, ack 37, win 313, length 156
20:38:17.140453 IP 157.245.94.33.22 > 198.96.85.163.26087: Flags [P.], seq 31892:32048, ack 37, win 313, length 156
20:38:17.140583 IP 157.245.94.33.22 > 198.96.85.163.26087: Flags [P.], seq 32048:32204, ack 37, win 313, length 156
20:38:17.140702 IP 157.245.94.33.22 > 198.96.85.163.26087: Flags [P.], seq 32204:32360, ack 37, win 313, length 156
20:38:17.140829 IP 157.245.94.33.22 > 198.96.85.163.26087: Flags [P.], seq 32360:32516, ack 37, win 313, length 156
20:38:17.140954 IP 157.245.94.33.22 > 198.96.85.163.26087: Flags [P.], seq 32516:32672, ack 37, win 313, length 156
20:38:17.141078 IP 157.245.94.33.22 > 198.96.85.163.26087: Flags [P.], seq 32672:32828, ack 37, win 313, length 156
20:38:17.141239 IP 157.245.94.33.22 > 198.96.85.163.26087: Flags [P.], seq 32828:32984, ack 37, win 313, length 156
20:38:17.141377 IP 157.245.94.33.22 > 198.96.85.163.26087: Flags [P.], seq 32984:33140, ack 37, win 313, length 156
20:38:17.141521 IP 157.245.94.33.22 > 198.96.85.163.26087: Flags [P.], seq 33140:33296, ack 37, win 313, length 156
20:38:17.141648 IP 157.245.94.33.22 > 198.96.85.163.26087: Flags [P.], seq 33296:33452, ack 37, win 313, length 156
20:38:17.141774 IP 157.245.94.33.22 > 198.96.85.163.26087: Flags [P.], seq 33452:33608, ack 37, win 313, length 156
20:38:17.141900 IP 157.245.94.33.22 > 198.96.85.163.26087: Flags [P.], seq 33608:33764, ack 37, win 313, length 156
20:38:17.142030 IP 157.245.94.33.22 > 198.96.85.163.26087: Flags [P.], seq 33764:33920, ack 37, win 313, length 156
20:38:17.142156 IP 157.245.94.33.22 > 198.96.85.163.26087: Flags [P.], seq 33920:34076, ack 37, win 313, length 156
20:38:17.142320 IP 157.245.94.33.22 > 198.96.85.163.26087: Flags [P.], seq 34076:34232, ack 37, win 313, length 156
20:38:17.142451 IP 157.245.94.33.22 > 198.96.85.163.26087: Flags [P.], seq 34232:34388, ack 37, win 313, length 156
20:38:17.142579 IP 157.245.94.33.22 > 198.96.85.163.26087: Flags [P.], seq 34388:34544, ack 37, win 313, length 156
20:38:17.142708 IP 157.245.94.33.22 > 198.96.85.163.26087: Flags [P.], seq 34544:34700, ack 37, win 313, length 156
20:38:17.142833 IP 157.245.94.33.22 > 198.96.85.163.26087: Flags [P.], seq 34700:34856, ack 37, win 313, length 156
20:38:17.142961 IP 157.245.94.33.22 > 198.96.85.163.26087: Flags [P.], seq 34856:35012, ack 37, win 313, length 156
20:38:17.143094 IP 157.245.94.33.22 > 198.96.85.163.26087: Flags [P.], seq 35012:35168, ack 37, win 313, length 156
20:38:17.143234 IP 157.245.94.33.22 > 198.96.85.163.26087: Flags [P.], seq 35168:35324, ack 37, win 313, length 156
20:38:17.143369 IP 157.245.94.33.22 > 198.96.85.163.26087: Flags [P.], seq 35324:35480, ack 37, win 313, length 156
20:38:17.143501 IP 157.245.94.33.22 > 198.96.85.163.26087: Flags [P.], seq 35480:35636, ack 37, win 313, length 156
20:38:17.143637 IP 157.245.94.33.22 > 198.96.85.163.26087: Flags [P.], seq 35636:35792, ack 37, win 313, length 156
20:38:17.143773 IP 157.245.94.33.22 > 198.96.85.163.26087: Flags [P.], seq 35792:35948, ack 37, win 313, length 156
20:38:17.143909 IP 157.245.94.33.22 > 198.96.85.163.26087: Flags [P.], seq 35948:36104, ack 37, win 313, length 156
20:38:17.144041 IP 157.245.94.33.22 > 198.96.85.163.26087: Flags [P.], seq 36104:36260, ack 37, win 313, length 156
20:38:17.144175 IP 157.245.94.33.22 > 198.96.85.163.26087: Flags [P.], seq 36260:36416, ack 37, win 313, length 156
20:38:17.144308 IP 157.245.94.33.22 > 198.96.85.163.26087: Flags [P.], seq 36416:36572, ack 37, win 313, length 156
20:38:17.151795 IP 198.96.85.163.26087 > 157.245.94.33.22: Flags [.], ack 22176, win 2050, length 0
20:38:17.151866 IP 157.245.94.33.22 > 198.96.85.163.26087: Flags [P.], seq 36572:36728, ack 37, win 313, length 156
20:38:17.152381 IP 198.96.85.163.26087 > 157.245.94.33.22: Flags [.], ack 23216, win 2046, length 0
20:38:17.152417 IP 157.245.94.33.22 > 198.96.85.163.26087: Flags [P.], seq 36728:36980, ack 37, win 313, length 252
20:38:17.152610 IP 157.245.94.33.22 > 198.96.85.163.26087: Flags [P.], seq 36980:37232, ack 37, win 313, length 252
20:38:17.152717 IP 157.245.94.33.22 > 198.96.85.163.26087: Flags [P.], seq 37232:37388, ack 37, win 313, length 156
20:38:17.152812 IP 157.245.94.33.22 > 198.96.85.163.26087: Flags [P.], seq 37388:37544, ack 37, win 313, length 156
20:38:17.152919 IP 157.245.94.33.22 > 198.96.85.163.26087: Flags [P.], seq 37544:37700, ack 37, win 313, length 156
20:38:17.154297 IP 198.96.85.163.26087 > 157.245.94.33.22: Flags [.], ack 24464, win 2051, length 0
20:38:17.154337 IP 157.245.94.33.22 > 198.96.85.163.26087: Flags [P.], seq 37700:37856, ack 37, win 313, length 156
20:38:17.154475 IP 157.245.94.33.22 > 198.96.85.163.26087: Flags [P.], seq 37856:38108, ack 37, win 313, length 252
20:38:17.154556 IP 157.245.94.33.22 > 198.96.85.163.26087: Flags [P.], seq 38108:38264, ack 37, win 313, length 156
20:38:17.154655 IP 157.245.94.33.22 > 198.96.85.163.26087: Flags [P.], seq 38264:38420, ack 37, win 313, length 156
20:38:17.154739 IP 157.245.94.33.22 > 198.96.85.163.26087: Flags [P.], seq 38420:38576, ack 37, win 313, length 156
20:38:17.154756 IP 198.96.85.163.26087 > 157.245.94.33.22: Flags [.], ack 26120, win 2051, length 0
20:38:17.154856 IP 157.245.94.33.22 > 198.96.85.163.26087: Flags [P.], seq 38576:38828, ack 37, win 313, length 252
20:38:17.154939 IP 157.245.94.33.22 > 198.96.85.163.26087: Flags [P.], seq 38828:38984, ack 37, win 313, length 156
20:38:17.155023 IP 157.245.94.33.22 > 198.96.85.163.26087: Flags [P.], seq 38984:39140, ack 37, win 313, length 156
20:38:17.155097 IP 157.245.94.33.22 > 198.96.85.163.26087: Flags [P.], seq 39140:39296, ack 37, win 313, length 156
20:38:17.155170 IP 157.245.94.33.22 > 198.96.85.163.26087: Flags [P.], seq 39296:39452, ack 37, win 313, length 156
20:38:17.155254 IP 157.245.94.33.22 > 198.96.85.163.26087: Flags [P.], seq 39452:39608, ack 37, win 313, length 156
20:38:17.155343 IP 157.245.94.33.22 > 198.96.85.163.26087: Flags [P.], seq 39608:39764, ack 37, win 313, length 156
20:38:17.155482 IP 157.245.94.33.22 > 198.96.85.163.26087: Flags [P.], seq 39764:39920, ack 37, win 313, length 156
20:38:17.155620 IP 157.245.94.33.22 > 198.96.85.163.26087: Flags [P.], seq 39920:40076, ack 37, win 313, length 156
20:38:17.155753 IP 157.245.94.33.22 > 198.96.85.163.26087: Flags [P.], seq 40076:40232, ack 37, win 313, length 156
20:38:17.155868 IP 157.245.94.33.22 > 198.96.85.163.26087: Flags [P.], seq 40232:40388, ack 37, win 313, length 156
20:38:17.155963 IP 157.245.94.33.22 > 198.96.85.163.26087: Flags [P.], seq 40388:40544, ack 37, win 313, length 156
20:38:17.156067 IP 157.245.94.33.22 > 198.96.85.163.26087: Flags [P.], seq 40544:40700, ack 37, win 313, length 156
20:38:17.156896 IP 198.96.85.163.26087 > 157.245.94.33.22: Flags [.], ack 27524, win 2051, length 0
20:38:17.156923 IP 157.245.94.33.22 > 198.96.85.163.26087: Flags [P.], seq 40700:40856, ack 37, win 313, length 156
20:38:17.157051 IP 157.245.94.33.22 > 198.96.85.163.26087: Flags [P.], seq 40856:41108, ack 37, win 313, length 252
20:38:17.157130 IP 157.245.94.33.22 > 198.96.85.163.26087: Flags [P.], seq 41108:41264, ack 37, win 313, length 156
20:38:17.157228 IP 157.245.94.33.22 > 198.96.85.163.26087: Flags [P.], seq 41264:41420, ack 37, win 313, length 156
20:38:17.157307 IP 157.245.94.33.22 > 198.96.85.163.26087: Flags [P.], seq 41420:41576, ack 37, win 313, length 156
20:38:17.157386 IP 157.245.94.33.22 > 198.96.85.163.26087: Flags [P.], seq 41576:41732, ack 37, win 313, length 156
20:38:17.157458 IP 157.245.94.33.22 > 198.96.85.163.26087: Flags [P.], seq 41732:41888, ack 37, win 313, length 156
20:38:17.157615 IP 157.245.94.33.22 > 198.96.85.163.26087: Flags [P.], seq 41888:42044, ack 37, win 313, length 156
20:38:17.157722 IP 157.245.94.33.22 > 198.96.85.163.26087: Flags [P.], seq 42044:42200, ack 37, win 313, length 156
20:38:17.157803 IP 157.245.94.33.22 > 198.96.85.163.26087: Flags [P.], seq 42200:42356, ack 37, win 313, length 156
20:38:17.158252 IP 198.96.85.163.26087 > 157.245.94.33.22: Flags [.], ack 27836, win 2050, length 0
20:38:17.158276 IP 157.245.94.33.22 > 198.96.85.163.26087: Flags [P.], seq 42356:42512, ack 37, win 313, length 156
20:38:17.158395 IP 157.245.94.33.22 > 198.96.85.163.26087: Flags [P.], seq 42512:42764, ack 37, win 313, length 252
20:38:17.159048 IP 198.96.85.163.26087 > 157.245.94.33.22: Flags [.], ack 30020, win 2051, length 0
20:38:17.159105 IP 157.245.94.33.22 > 198.96.85.163.26087: Flags [P.], seq 42764:42920, ack 37, win 313, length 156
20:38:17.159280 IP 157.245.94.33.22 > 198.96.85.163.26087: Flags [P.], seq 42920:43172, ack 37, win 313, length 252
20:38:17.159428 IP 157.245.94.33.22 > 198.96.85.163.26087: Flags [P.], seq 43172:43328, ack 37, win 313, length 156
20:38:17.159547 IP 157.245.94.33.22 > 198.96.85.163.26087: Flags [P.], seq 43328:43484, ack 37, win 313, length 156
20:38:17.159630 IP 157.245.94.33.22 > 198.96.85.163.26087: Flags [P.], seq 43484:43640, ack 37, win 313, length 156
20:38:17.159707 IP 157.245.94.33.22 > 198.96.85.163.26087: Flags [P.], seq 43640:43796, ack 37, win 313, length 156
20:38:17.159779 IP 157.245.94.33.22 > 198.96.85.163.26087: Flags [P.], seq 43796:43952, ack 37, win 313, length 156
20:38:17.159851 IP 157.245.94.33.22 > 198.96.85.163.26087: Flags [P.], seq 43952:44108, ack 37, win 313, length 156
20:38:17.159922 IP 157.245.94.33.22 > 198.96.85.163.26087: Flags [P.], seq 44108:44264, ack 37, win 313, length 156
20:38:17.159993 IP 157.245.94.33.22 > 198.96.85.163.26087: Flags [P.], seq 44264:44420, ack 37, win 313, length 156
20:38:17.160064 IP 157.245.94.33.22 > 198.96.85.163.26087: Flags [P.], seq 44420:44576, ack 37, win 313, length 156
20:38:17.160134 IP 157.245.94.33.22 > 198.96.85.163.26087: Flags [P.], seq 44576:44732, ack 37, win 313, length 156
20:38:17.160205 IP 157.245.94.33.22 > 198.96.85.163.26087: Flags [P.], seq 44732:44888, ack 37, win 313, length 156
20:38:17.160313 IP 157.245.94.33.22 > 198.96.85.163.26087: Flags [P.], seq 44888:45044, ack 37, win 313, length 156
20:38:17.160616 IP 198.96.85.163.26087 > 157.245.94.33.22: Flags [.], ack 32672, win 2051, length 0
20:38:17.160649 IP 157.245.94.33.22 > 198.96.85.163.26087: Flags [P.], seq 45044:45200, ack 37, win 313, length 156
20:38:17.160848 IP 157.245.94.33.22 > 198.96.85.163.26087: Flags [P.], seq 45200:45452, ack 37, win 313, length 252
20:38:17.160949 IP 157.245.94.33.22 > 198.96.85.163.26087: Flags [P.], seq 45452:45608, ack 37, win 313, length 156
20:38:17.161001 IP 198.96.85.163.26087 > 157.245.94.33.22: Flags [.], ack 33452, win 2048, length 0
20:38:17.161100 IP 157.245.94.33.22 > 198.96.85.163.26087: Flags [P.], seq 45608:45860, ack 37, win 313, length 252
20:38:17.161217 IP 157.245.94.33.22 > 198.96.85.163.26087: Flags [P.], seq 45860:46016, ack 37, win 313, length 156
20:38:17.161316 IP 157.245.94.33.22 > 198.96.85.163.26087: Flags [P.], seq 46016:46172, ack 37, win 313, length 156
20:38:17.161389 IP 157.245.94.33.22 > 198.96.85.163.26087: Flags [P.], seq 46172:46328, ack 37, win 313, length 156
20:38:17.161464 IP 157.245.94.33.22 > 198.96.85.163.26087: Flags [P.], seq 46328:46484, ack 37, win 313, length 156
20:38:17.161537 IP 157.245.94.33.22 > 198.96.85.163.26087: Flags [P.], seq 46484:46640, ack 37, win 313, length 156
20:38:17.161609 IP 157.245.94.33.22 > 198.96.85.163.26087: Flags [P.], seq 46640:46796, ack 37, win 313, length 156
20:38:17.161689 IP 157.245.94.33.22 > 198.96.85.163.26087: Flags [P.], seq 46796:46952, ack 37, win 313, length 156
20:38:17.161827 IP 157.245.94.33.22 > 198.96.85.163.26087: Flags [P.], seq 46952:47108, ack 37, win 313, length 156
20:38:17.161921 IP 157.245.94.33.22 > 198.96.85.163.26087: Flags [P.], seq 47108:47264, ack 37, win 313, length 156
20:38:17.161997 IP 157.245.94.33.22 > 198.96.85.163.26087: Flags [P.], seq 47264:47420, ack 37, win 313, length 156
20:38:17.162068 IP 157.245.94.33.22 > 198.96.85.163.26087: Flags [P.], seq 47420:47576, ack 37, win 313, length 156
20:38:17.162140 IP 157.245.94.33.22 > 198.96.85.163.26087: Flags [P.], seq 47576:47732, ack 37, win 313, length 156
20:38:17.162256 IP 157.245.94.33.22 > 198.96.85.163.26087: Flags [P.], seq 47732:47888, ack 37, win 313, length 156
20:38:17.162334 IP 157.245.94.33.22 > 198.96.85.163.26087: Flags [P.], seq 47888:48044, ack 37, win 313, length 156
20:38:17.162406 IP 157.245.94.33.22 > 198.96.85.163.26087: Flags [P.], seq 48044:48200, ack 37, win 313, length 156
20:38:17.162482 IP 157.245.94.33.22 > 198.96.85.163.26087: Flags [P.], seq 48200:48356, ack 37, win 313, length 156
20:38:17.162540 IP 157.245.94.33.22 > 198.96.85.163.26087: Flags [P.], seq 48356:48512, ack 37, win 313, length 156
20:38:17.162597 IP 157.245.94.33.22 > 198.96.85.163.26087: Flags [P.], seq 48512:48668, ack 37, win 313, length 156
20:38:17.164295 IP 198.96.85.163.26087 > 157.245.94.33.22: Flags [.], ack 36572, win 2051, length 0
20:38:17.164331 IP 157.245.94.33.22 > 198.96.85.163.26087: Flags [P.], seq 48668:48824, ack 37, win 313, length 156
20:38:17.164463 IP 157.245.94.33.22 > 198.96.85.163.26087: Flags [P.], seq 48824:49076, ack 37, win 313, length 252
20:38:17.164569 IP 157.245.94.33.22 > 198.96.85.163.26087: Flags [P.], seq 49076:49232, ack 37, win 313, length 156
20:38:17.164649 IP 157.245.94.33.22 > 198.96.85.163.26087: Flags [P.], seq 49232:49388, ack 37, win 313, length 156
20:38:17.164727 IP 157.245.94.33.22 > 198.96.85.163.26087: Flags [P.], seq 49388:49544, ack 37, win 313, length 156
20:38:17.164805 IP 157.245.94.33.22 > 198.96.85.163.26087: Flags [P.], seq 49544:49700, ack 37, win 313, length 156
20:38:17.164880 IP 157.245.94.33.22 > 198.96.85.163.26087: Flags [P.], seq 49700:49856, ack 37, win 313, length 156
20:38:17.164956 IP 157.245.94.33.22 > 198.96.85.163.26087: Flags [P.], seq 49856:50012, ack 37, win 313, length 156
20:38:17.165031 IP 157.245.94.33.22 > 198.96.85.163.26087: Flags [P.], seq 50012:50168, ack 37, win 313, length 156
20:38:17.165166 IP 157.245.94.33.22 > 198.96.85.163.26087: Flags [P.], seq 50168:50324, ack 37, win 313, length 156
20:38:17.165283 IP 157.245.94.33.22 > 198.96.85.163.26087: Flags [P.], seq 50324:50480, ack 37, win 313, length 156
20:38:17.165417 IP 157.245.94.33.22 > 198.96.85.163.26087: Flags [P.], seq 50480:50636, ack 37, win 313, length 156
20:38:17.165527 IP 157.245.94.33.22 > 198.96.85.163.26087: Flags [P.], seq 50636:50792, ack 37, win 313, length 156
20:38:17.165619 IP 157.245.94.33.22 > 198.96.85.163.26087: Flags [P.], seq 50792:50948, ack 37, win 313, length 156
20:38:17.165764 IP 157.245.94.33.22 > 198.96.85.163.26087: Flags [P.], seq 50948:51104, ack 37, win 313, length 156
20:38:17.165883 IP 157.245.94.33.22 > 198.96.85.163.26087: Flags [P.], seq 51104:51260, ack 37, win 313, length 156
20:38:17.165965 IP 157.245.94.33.22 > 198.96.85.163.26087: Flags [P.], seq 51260:51416, ack 37, win 313, length 156
20:38:17.166042 IP 157.245.94.33.22 > 198.96.85.163.26087: Flags [P.], seq 51416:51572, ack 37, win 313, length 156
20:38:17.166124 IP 157.245.94.33.22 > 198.96.85.163.26087: Flags [P.], seq 51572:51728, ack 37, win 313, length 156
20:38:17.166263 IP 157.245.94.33.22 > 198.96.85.163.26087: Flags [P.], seq 51728:51884, ack 37, win 313, length 156
20:38:17.166358 IP 157.245.94.33.22 > 198.96.85.163.26087: Flags [P.], seq 51884:52040, ack 37, win 313, length 156
20:38:17.172524 IP 198.96.85.163.26087 > 157.245.94.33.22: Flags [.], ack 37700, win 2047, length 0
20:38:17.172582 IP 157.245.94.33.22 > 198.96.85.163.26087: Flags [P.], seq 52040:52196, ack 37, win 313, length 156
20:38:17.172773 IP 157.245.94.33.22 > 198.96.85.163.26087: Flags [P.], seq 52196:52448, ack 37, win 313, length 252
20:38:17.172863 IP 157.245.94.33.22 > 198.96.85.163.26087: Flags [P.], seq 52448:52604, ack 37, win 313, length 156
20:38:17.172939 IP 157.245.94.33.22 > 198.96.85.163.26087: Flags [P.], seq 52604:52760, ack 37, win 313, length 156
20:38:17.173013 IP 157.245.94.33.22 > 198.96.85.163.26087: Flags [P.], seq 52760:52916, ack 37, win 313, length 156
20:38:17.173102 IP 157.245.94.33.22 > 198.96.85.163.26087: Flags [P.], seq 52916:53072, ack 37, win 313, length 156
20:38:17.175858 IP 198.96.85.163.26087 > 157.245.94.33.22: Flags [.], ack 40700, win 2051, length 0
20:38:17.175914 IP 157.245.94.33.22 > 198.96.85.163.26087: Flags [P.], seq 53072:53228, ack 37, win 313, length 156
20:38:17.176088 IP 157.245.94.33.22 > 198.96.85.163.26087: Flags [P.], seq 53228:53480, ack 37, win 313, length 252
20:38:17.176207 IP 157.245.94.33.22 > 198.96.85.163.26087: Flags [P.], seq 53480:53636, ack 37, win 313, length 156
20:38:17.176297 IP 157.245.94.33.22 > 198.96.85.163.26087: Flags [P.], seq 53636:53792, ack 37, win 313, length 156
20:38:17.176381 IP 157.245.94.33.22 > 198.96.85.163.26087: Flags [P.], seq 53792:53948, ack 37, win 313, length 156
20:38:17.176459 IP 157.245.94.33.22 > 198.96.85.163.26087: Flags [P.], seq 53948:54104, ack 37, win 313, length 156
20:38:17.176534 IP 157.245.94.33.22 > 198.96.85.163.26087: Flags [P.], seq 54104:54260, ack 37, win 313, length 156
20:38:17.176609 IP 157.245.94.33.22 > 198.96.85.163.26087: Flags [P.], seq 54260:54416, ack 37, win 313, length 156
20:38:17.176683 IP 157.245.94.33.22 > 198.96.85.163.26087: Flags [P.], seq 54416:54572, ack 37, win 313, length 156
20:38:17.176756 IP 157.245.94.33.22 > 198.96.85.163.26087: Flags [P.], seq 54572:54728, ack 37, win 313, length 156
20:38:17.176828 IP 157.245.94.33.22 > 198.96.85.163.26087: Flags [P.], seq 54728:54884, ack 37, win 313, length 156
20:38:17.176900 IP 157.245.94.33.22 > 198.96.85.163.26087: Flags [P.], seq 54884:55040, ack 37, win 313, length 156
20:38:17.176973 IP 157.245.94.33.22 > 198.96.85.163.26087: Flags [P.], seq 55040:55196, ack 37, win 313, length 156
20:38:17.177044 IP 157.245.94.33.22 > 198.96.85.163.26087: Flags [P.], seq 55196:55352, ack 37, win 313, length 156
20:38:17.177135 IP 157.245.94.33.22 > 198.96.85.163.26087: Flags [P.], seq 55352:55508, ack 37, win 313, length 156
20:38:17.177281 IP 157.245.94.33.22 > 198.96.85.163.26087: Flags [P.], seq 55508:55664, ack 37, win 313, length 156
20:38:17.177379 IP 157.245.94.33.22 > 198.96.85.163.26087: Flags [P.], seq 55664:55820, ack 37, win 313, length 156
20:38:17.177489 IP 198.96.85.163.26087 > 157.245.94.33.22: Flags [.], ack 42356, win 2051, length 0
20:38:17.177737 IP 157.245.94.33.22 > 198.96.85.163.26087: Flags [P.], seq 55820:56072, ack 37, win 313, length 252
20:38:17.177847 IP 157.245.94.33.22 > 198.96.85.163.26087: Flags [P.], seq 56072:56228, ack 37, win 313, length 156
20:38:17.177906 IP 198.96.85.163.26087 > 157.245.94.33.22: Flags [.], ack 42764, win 2049, length 0
20:38:17.177998 IP 157.245.94.33.22 > 198.96.85.163.26087: Flags [P.], seq 56228:56480, ack 37, win 313, length 252
20:38:17.178108 IP 157.245.94.33.22 > 198.96.85.163.26087: Flags [P.], seq 56480:56636, ack 37, win 313, length 156
20:38:17.178229 IP 157.245.94.33.22 > 198.96.85.163.26087: Flags [P.], seq 56636:56792, ack 37, win 313, length 156
20:38:17.178373 IP 157.245.94.33.22 > 198.96.85.163.26087: Flags [P.], seq 56792:56948, ack 37, win 313, length 156
20:38:17.178500 IP 157.245.94.33.22 > 198.96.85.163.26087: Flags [P.], seq 56948:57104, ack 37, win 313, length 156
20:38:17.178601 IP 157.245.94.33.22 > 198.96.85.163.26087: Flags [P.], seq 57104:57260, ack 37, win 313, length 156
20:38:17.178675 IP 157.245.94.33.22 > 198.96.85.163.26087: Flags [P.], seq 57260:57416, ack 37, win 313, length 156
20:38:17.178760 IP 157.245.94.33.22 > 198.96.85.163.26087: Flags [P.], seq 57416:57572, ack 37, win 313, length 156
20:38:17.178836 IP 157.245.94.33.22 > 198.96.85.163.26087: Flags [P.], seq 57572:57728, ack 37, win 313, length 156
20:38:17.178914 IP 157.245.94.33.22 > 198.96.85.163.26087: Flags [P.], seq 57728:57884, ack 37, win 313, length 156
20:38:17.178988 IP 157.245.94.33.22 > 198.96.85.163.26087: Flags [P.], seq 57884:58040, ack 37, win 313, length 156
20:38:17.179066 IP 157.245.94.33.22 > 198.96.85.163.26087: Flags [P.], seq 58040:58196, ack 37, win 313, length 156
20:38:17.179927 IP 198.96.85.163.26087 > 157.245.94.33.22: Flags [.], ack 45044, win 2051, length 0
20:38:17.179963 IP 157.245.94.33.22 > 198.96.85.163.26087: Flags [P.], seq 58196:58352, ack 37, win 313, length 156
20:38:17.180141 IP 157.245.94.33.22 > 198.96.85.163.26087: Flags [P.], seq 58352:58604, ack 37, win 313, length 252
20:38:17.180300 IP 157.245.94.33.22 > 198.96.85.163.26087: Flags [P.], seq 58604:58760, ack 37, win 313, length 156
20:38:17.180435 IP 157.245.94.33.22 > 198.96.85.163.26087: Flags [P.], seq 58760:58916, ack 37, win 313, length 156
20:38:17.180517 IP 157.245.94.33.22 > 198.96.85.163.26087: Flags [P.], seq 58916:59072, ack 37, win 313, length 156
20:38:17.180593 IP 157.245.94.33.22 > 198.96.85.163.26087: Flags [P.], seq 59072:59228, ack 37, win 313, length 156
20:38:17.180670 IP 157.245.94.33.22 > 198.96.85.163.26087: Flags [P.], seq 59228:59384, ack 37, win 313, length 156
20:38:17.180746 IP 157.245.94.33.22 > 198.96.85.163.26087: Flags [P.], seq 59384:59540, ack 37, win 313, length 156
20:38:17.180823 IP 157.245.94.33.22 > 198.96.85.163.26087: Flags [P.], seq 59540:59696, ack 37, win 313, length 156
20:38:17.180898 IP 157.245.94.33.22 > 198.96.85.163.26087: Flags [P.], seq 59696:59852, ack 37, win 313, length 156
20:38:17.180980 IP 157.245.94.33.22 > 198.96.85.163.26087: Flags [P.], seq 59852:60008, ack 37, win 313, length 156
20:38:17.181055 IP 157.245.94.33.22 > 198.96.85.163.26087: Flags [P.], seq 60008:60164, ack 37, win 313, length 156
20:38:17.181130 IP 157.245.94.33.22 > 198.96.85.163.26087: Flags [P.], seq 60164:60320, ack 37, win 313, length 156
20:38:17.181226 IP 157.245.94.33.22 > 198.96.85.163.26087: Flags [P.], seq 60320:60476, ack 37, win 313, length 156
20:38:17.181888 IP 198.96.85.163.26087 > 157.245.94.33.22: Flags [.], ack 48044, win 2051, length 0
20:38:17.181922 IP 157.245.94.33.22 > 198.96.85.163.26087: Flags [P.], seq 60476:60632, ack 37, win 313, length 156
20:38:17.182046 IP 157.245.94.33.22 > 198.96.85.163.26087: Flags [P.], seq 60632:60884, ack 37, win 313, length 252
20:38:17.182143 IP 157.245.94.33.22 > 198.96.85.163.26087: Flags [P.], seq 60884:61040, ack 37, win 313, length 156
20:38:17.182258 IP 198.96.85.163.26087 > 157.245.94.33.22: Flags [.], ack 48668, win 2049, length 0
20:38:17.182360 IP 157.245.94.33.22 > 198.96.85.163.26087: Flags [P.], seq 61040:61196, ack 37, win 313, length 156
20:38:17.182443 IP 157.245.94.33.22 > 198.96.85.163.26087: Flags [P.], seq 61196:61336, ack 37, win 313, length 140
20:38:17.182546 IP 157.245.94.33.22 > 198.96.85.163.26087: Flags [P.], seq 61336:61492, ack 37, win 313, length 156
20:38:17.182633 IP 157.245.94.33.22 > 198.96.85.163.26087: Flags [P.], seq 61492:61648, ack 37, win 313, length 156
20:38:17.182716 IP 157.245.94.33.22 > 198.96.85.163.26087: Flags [P.], seq 61648:61804, ack 37, win 313, length 156
20:38:17.182788 IP 157.245.94.33.22 > 198.96.85.163.26087: Flags [P.], seq 61804:61960, ack 37, win 313, length 156
20:38:17.182876 IP 157.245.94.33.22 > 198.96.85.163.26087: Flags [P.], seq 61960:62116, ack 37, win 313, length 156
20:38:17.182953 IP 157.245.94.33.22 > 198.96.85.163.26087: Flags [P.], seq 62116:62272, ack 37, win 313, length 156
20:38:17.183028 IP 157.245.94.33.22 > 198.96.85.163.26087: Flags [P.], seq 62272:62428, ack 37, win 313, length 156
20:38:17.183100 IP 157.245.94.33.22 > 198.96.85.163.26087: Flags [P.], seq 62428:62584, ack 37, win 313, length 156
20:38:17.183190 IP 157.245.94.33.22 > 198.96.85.163.26087: Flags [P.], seq 62584:62740, ack 37, win 313, length 156
20:38:17.183275 IP 157.245.94.33.22 > 198.96.85.163.26087: Flags [P.], seq 62740:62896, ack 37, win 313, length 156
20:38:17.183354 IP 157.245.94.33.22 > 198.96.85.163.26087: Flags [P.], seq 62896:63052, ack 37, win 313, length 156
20:38:17.183427 IP 157.245.94.33.22 > 198.96.85.163.26087: Flags [P.], seq 63052:63208, ack 37, win 313, length 156
20:38:17.183513 IP 157.245.94.33.22 > 198.96.85.163.26087: Flags [P.], seq 63208:63364, ack 37, win 313, length 156
20:38:17.183590 IP 157.245.94.33.22 > 198.96.85.163.26087: Flags [P.], seq 63364:63520, ack 37, win 313, length 156
20:38:17.183665 IP 157.245.94.33.22 > 198.96.85.163.26087: Flags [P.], seq 63520:63676, ack 37, win 313, length 156
20:38:17.183737 IP 157.245.94.33.22 > 198.96.85.163.26087: Flags [P.], seq 63676:63832, ack 37, win 313, length 156
20:38:17.183834 IP 157.245.94.33.22 > 198.96.85.163.26087: Flags [P.], seq 63832:63988, ack 37, win 313, length 156
20:38:17.184909 IP 198.96.85.163.26087 > 157.245.94.33.22: Flags [.], ack 50324, win 2051, length 0
20:38:17.184940 IP 157.245.94.33.22 > 198.96.85.163.26087: Flags [P.], seq 63988:64300, ack 37, win 313, length 312
20:38:17.185069 IP 157.245.94.33.22 > 198.96.85.163.26087: Flags [P.], seq 64300:64552, ack 37, win 313, length 252
20:38:17.185174 IP 157.245.94.33.22 > 198.96.85.163.26087: Flags [P.], seq 64552:64708, ack 37, win 313, length 156
20:38:17.185316 IP 157.245.94.33.22 > 198.96.85.163.26087: Flags [P.], seq 64708:64864, ack 37, win 313, length 156
20:38:17.185401 IP 157.245.94.33.22 > 198.96.85.163.26087: Flags [P.], seq 64864:65020, ack 37, win 313, length 156
20:38:17.185482 IP 157.245.94.33.22 > 198.96.85.163.26087: Flags [P.], seq 65020:65176, ack 37, win 313, length 156
20:38:17.185560 IP 157.245.94.33.22 > 198.96.85.163.26087: Flags [P.], seq 65176:65332, ack 37, win 313, length 156
20:38:17.185636 IP 157.245.94.33.22 > 198.96.85.163.26087: Flags [P.], seq 65332:65488, ack 37, win 313, length 156
20:38:17.185717 IP 157.245.94.33.22 > 198.96.85.163.26087: Flags [P.], seq 65488:65644, ack 37, win 313, length 156
20:38:17.185795 IP 157.245.94.33.22 > 198.96.85.163.26087: Flags [P.], seq 65644:65800, ack 37, win 313, length 156
20:38:17.186223 IP 198.96.85.163.26087 > 157.245.94.33.22: Flags [.], ack 52040, win 2051, length 0
20:38:17.186259 IP 157.245.94.33.22 > 198.96.85.163.26087: Flags [P.], seq 65800:65956, ack 37, win 313, length 156
20:38:17.186382 IP 157.245.94.33.22 > 198.96.85.163.26087: Flags [P.], seq 65956:66208, ack 37, win 313, length 252
20:38:17.186469 IP 157.245.94.33.22 > 198.96.85.163.26087: Flags [P.], seq 66208:66364, ack 37, win 313, length 156
20:38:17.186554 IP 157.245.94.33.22 > 198.96.85.163.26087: Flags [P.], seq 66364:66520, ack 37, win 313, length 156
20:38:17.186632 IP 157.245.94.33.22 > 198.96.85.163.26087: Flags [P.], seq 66520:66676, ack 37, win 313, length 156
20:38:17.186710 IP 157.245.94.33.22 > 198.96.85.163.26087: Flags [P.], seq 66676:66832, ack 37, win 313, length 156
20:38:17.186789 IP 157.245.94.33.22 > 198.96.85.163.26087: Flags [P.], seq 66832:66988, ack 37, win 313, length 156
20:38:17.186865 IP 157.245.94.33.22 > 198.96.85.163.26087: Flags [P.], seq 66988:67144, ack 37, win 313, length 156
20:38:17.186940 IP 157.245.94.33.22 > 198.96.85.163.26087: Flags [P.], seq 67144:67300, ack 37, win 313, length 156
20:38:17.187016 IP 157.245.94.33.22 > 198.96.85.163.26087: Flags [P.], seq 67300:67456, ack 37, win 313, length 156
20:38:17.187091 IP 157.245.94.33.22 > 198.96.85.163.26087: Flags [P.], seq 67456:67612, ack 37, win 313, length 156
20:38:17.192678 IP 198.96.85.163.26087 > 157.245.94.33.22: Flags [.], ack 53072, win 2047, length 0
20:38:17.192730 IP 157.245.94.33.22 > 198.96.85.163.26087: Flags [P.], seq 67612:67768, ack 37, win 313, length 156
20:38:17.192914 IP 157.245.94.33.22 > 198.96.85.163.26087: Flags [P.], seq 67768:68020, ack 37, win 313, length 252
20:38:17.193013 IP 157.245.94.33.22 > 198.96.85.163.26087: Flags [P.], seq 68020:68176, ack 37, win 313, length 156
20:38:17.193091 IP 157.245.94.33.22 > 198.96.85.163.26087: Flags [P.], seq 68176:68332, ack 37, win 313, length 156
20:38:17.193167 IP 157.245.94.33.22 > 198.96.85.163.26087: Flags [P.], seq 68332:68488, ack 37, win 313, length 156
20:38:17.193272 IP 157.245.94.33.22 > 198.96.85.163.26087: Flags [P.], seq 68488:68644, ack 37, win 313, length 156
20:38:17.197911 IP 198.96.85.163.26087 > 157.245.94.33.22: Flags [.], ack 55820, win 2051, length 0
20:38:17.197974 IP 157.245.94.33.22 > 198.96.85.163.26087: Flags [P.], seq 68644:68800, ack 37, win 313, length 156
20:38:17.197994 IP 198.96.85.163.26087 > 157.245.94.33.22: Flags [.], ack 56792, win 2047, length 0
20:38:17.198165 IP 157.245.94.33.22 > 198.96.85.163.26087: Flags [P.], seq 68800:69156, ack 37, win 313, length 356
20:38:17.198307 IP 157.245.94.33.22 > 198.96.85.163.26087: Flags [P.], seq 69156:69312, ack 37, win 313, length 156
20:38:17.198411 IP 198.96.85.163.26087 > 157.245.94.33.22: Flags [.], ack 58196, win 2051, length 0
20:38:17.198433 IP 157.245.94.33.22 > 198.96.85.163.26087: Flags [P.], seq 69312:69468, ack 37, win 313, length 156
20:38:17.198543 IP 157.245.94.33.22 > 198.96.85.163.26087: Flags [P.], seq 69468:69720, ack 37, win 313, length 252
20:38:17.198627 IP 157.245.94.33.22 > 198.96.85.163.26087: Flags [P.], seq 69720:69876, ack 37, win 313, length 156
20:38:17.198701 IP 157.245.94.33.22 > 198.96.85.163.26087: Flags [P.], seq 69876:70032, ack 37, win 313, length 156
20:38:17.198776 IP 157.245.94.33.22 > 198.96.85.163.26087: Flags [P.], seq 70032:70188, ack 37, win 313, length 156
20:38:17.198848 IP 157.245.94.33.22 > 198.96.85.163.26087: Flags [P.], seq 70188:70344, ack 37, win 313, length 156
20:38:17.198921 IP 157.245.94.33.22 > 198.96.85.163.26087: Flags [P.], seq 70344:70500, ack 37, win 313, length 156
20:38:17.198994 IP 157.245.94.33.22 > 198.96.85.163.26087: Flags [P.], seq 70500:70656, ack 37, win 313, length 156
20:38:17.199066 IP 157.245.94.33.22 > 198.96.85.163.26087: Flags [P.], seq 70656:70812, ack 37, win 313, length 156
20:38:17.199164 IP 157.245.94.33.22 > 198.96.85.163.26087: Flags [P.], seq 70812:70968, ack 37, win 313, length 156
20:38:17.199293 IP 157.245.94.33.22 > 198.96.85.163.26087: Flags [P.], seq 70968:71124, ack 37, win 313, length 156
20:38:17.199423 IP 157.245.94.33.22 > 198.96.85.163.26087: Flags [P.], seq 71124:71280, ack 37, win 313, length 156
20:38:17.199551 IP 157.245.94.33.22 > 198.96.85.163.26087: Flags [P.], seq 71280:71436, ack 37, win 313, length 156
20:38:17.199687 IP 157.245.94.33.22 > 198.96.85.163.26087: Flags [P.], seq 71436:71592, ack 37, win 313, length 156
20:38:17.199810 IP 157.245.94.33.22 > 198.96.85.163.26087: Flags [P.], seq 71592:71748, ack 37, win 313, length 156
20:38:17.199897 IP 157.245.94.33.22 > 198.96.85.163.26087: Flags [P.], seq 71748:71904, ack 37, win 313, length 156
20:38:17.199978 IP 198.96.85.163.26087 > 157.245.94.33.22: Flags [.], ack 58604, win 2049, length 0
20:38:17.200025 IP 157.245.94.33.22 > 198.96.85.163.26087: Flags [P.], seq 71904:72060, ack 37, win 313, length 156
20:38:17.200108 IP 157.245.94.33.22 > 198.96.85.163.26087: Flags [P.], seq 72060:72312, ack 37, win 313, length 252
20:38:17.200184 IP 157.245.94.33.22 > 198.96.85.163.26087: Flags [P.], seq 72312:72468, ack 37, win 313, length 156
20:38:17.200264 IP 157.245.94.33.22 > 198.96.85.163.26087: Flags [P.], seq 72468:72624, ack 37, win 313, length 156
20:38:17.200337 IP 157.245.94.33.22 > 198.96.85.163.26087: Flags [P.], seq 72624:72780, ack 37, win 313, length 156
20:38:17.200409 IP 157.245.94.33.22 > 198.96.85.163.26087: Flags [P.], seq 72780:72936, ack 37, win 313, length 156
20:38:17.200480 IP 157.245.94.33.22 > 198.96.85.163.26087: Flags [P.], seq 72936:73092, ack 37, win 313, length 156
20:38:17.200532 IP 198.96.85.163.26087 > 157.245.94.33.22: Flags [.], ack 60476, win 2051, length 0
20:38:17.200611 IP 157.245.94.33.22 > 198.96.85.163.26087: Flags [P.], seq 73092:73344, ack 37, win 313, length 252
20:38:17.200692 IP 157.245.94.33.22 > 198.96.85.163.26087: Flags [P.], seq 73344:73500, ack 37, win 313, length 156
20:38:17.200770 IP 157.245.94.33.22 > 198.96.85.163.26087: Flags [P.], seq 73500:73656, ack 37, win 313, length 156
20:38:17.200845 IP 157.245.94.33.22 > 198.96.85.163.26087: Flags [P.], seq 73656:73812, ack 37, win 313, length 156
20:38:17.200921 IP 157.245.94.33.22 > 198.96.85.163.26087: Flags [P.], seq 73812:73968, ack 37, win 313, length 156
20:38:17.200995 IP 157.245.94.33.22 > 198.96.85.163.26087: Flags [P.], seq 73968:74124, ack 37, win 313, length 156
20:38:17.201106 IP 157.245.94.33.22 > 198.96.85.163.26087: Flags [P.], seq 74124:74280, ack 37, win 313, length 156
20:38:17.201248 IP 157.245.94.33.22 > 198.96.85.163.26087: Flags [P.], seq 74280:74436, ack 37, win 313, length 156
20:38:17.201373 IP 157.245.94.33.22 > 198.96.85.163.26087: Flags [P.], seq 74436:74592, ack 37, win 313, length 156
20:38:17.201462 IP 157.245.94.33.22 > 198.96.85.163.26087: Flags [P.], seq 74592:74748, ack 37, win 313, length 156
20:38:17.201540 IP 157.245.94.33.22 > 198.96.85.163.26087: Flags [P.], seq 74748:74904, ack 37, win 313, length 156
20:38:17.201614 IP 157.245.94.33.22 > 198.96.85.163.26087: Flags [P.], seq 74904:75060, ack 37, win 313, length 156
20:38:17.201692 IP 157.245.94.33.22 > 198.96.85.163.26087: Flags [P.], seq 75060:75216, ack 37, win 313, length 156
20:38:17.201771 IP 157.245.94.33.22 > 198.96.85.163.26087: Flags [P.], seq 75216:75372, ack 37, win 313, length 156
20:38:17.201855 IP 157.245.94.33.22 > 198.96.85.163.26087: Flags [P.], seq 75372:75528, ack 37, win 313, length 156
20:38:17.201936 IP 157.245.94.33.22 > 198.96.85.163.26087: Flags [P.], seq 75528:75684, ack 37, win 313, length 156
20:38:17.202013 IP 157.245.94.33.22 > 198.96.85.163.26087: Flags [P.], seq 75684:75840, ack 37, win 313, length 156
20:38:17.202136 IP 157.245.94.33.22 > 198.96.85.163.26087: Flags [P.], seq 75840:75996, ack 37, win 313, length 156
20:38:17.202287 IP 157.245.94.33.22 > 198.96.85.163.26087: Flags [P.], seq 75996:76152, ack 37, win 313, length 156
20:38:17.202371 IP 157.245.94.33.22 > 198.96.85.163.26087: Flags [P.], seq 76152:76308, ack 37, win 313, length 156
20:38:17.203629 IP 198.96.85.163.26087 > 157.245.94.33.22: Flags [.], ack 63988, win 2051, length 0
20:38:17.203671 IP 157.245.94.33.22 > 198.96.85.163.26087: Flags [P.], seq 76308:76464, ack 37, win 313, length 156
20:38:17.203819 IP 157.245.94.33.22 > 198.96.85.163.26087: Flags [P.], seq 76464:76716, ack 37, win 313, length 252
20:38:17.203903 IP 157.245.94.33.22 > 198.96.85.163.26087: Flags [P.], seq 76716:76872, ack 37, win 313, length 156
20:38:17.203977 IP 157.245.94.33.22 > 198.96.85.163.26087: Flags [P.], seq 76872:77028, ack 37, win 313, length 156
20:38:17.204056 IP 157.245.94.33.22 > 198.96.85.163.26087: Flags [P.], seq 77028:77184, ack 37, win 313, length 156
20:38:17.204196 IP 157.245.94.33.22 > 198.96.85.163.26087: Flags [P.], seq 77184:77340, ack 37, win 313, length 156
20:38:17.204287 IP 157.245.94.33.22 > 198.96.85.163.26087: Flags [P.], seq 77340:77496, ack 37, win 313, length 156
20:38:17.204383 IP 157.245.94.33.22 > 198.96.85.163.26087: Flags [P.], seq 77496:77652, ack 37, win 313, length 156
20:38:17.204456 IP 157.245.94.33.22 > 198.96.85.163.26087: Flags [P.], seq 77652:77808, ack 37, win 313, length 156
20:38:17.204531 IP 157.245.94.33.22 > 198.96.85.163.26087: Flags [P.], seq 77808:77964, ack 37, win 313, length 156
20:38:17.204604 IP 157.245.94.33.22 > 198.96.85.163.26087: Flags [P.], seq 77964:78120, ack 37, win 313, length 156
20:38:17.204745 IP 157.245.94.33.22 > 198.96.85.163.26087: Flags [P.], seq 78120:78276, ack 37, win 313, length 156
20:38:17.204879 IP 157.245.94.33.22 > 198.96.85.163.26087: Flags [P.], seq 78276:78432, ack 37, win 313, length 156
20:38:17.205007 IP 157.245.94.33.22 > 198.96.85.163.26087: Flags [P.], seq 78432:78588, ack 37, win 313, length 156
20:38:17.205134 IP 157.245.94.33.22 > 198.96.85.163.26087: Flags [P.], seq 78588:78744, ack 37, win 313, length 156
20:38:17.205240 IP 157.245.94.33.22 > 198.96.85.163.26087: Flags [P.], seq 78744:78900, ack 37, win 313, length 156
20:38:17.205358 IP 157.245.94.33.22 > 198.96.85.163.26087: Flags [P.], seq 78900:79056, ack 37, win 313, length 156
20:38:17.205446 IP 157.245.94.33.22 > 198.96.85.163.26087: Flags [P.], seq 79056:79212, ack 37, win 313, length 156
20:38:17.205553 IP 157.245.94.33.22 > 198.96.85.163.26087: Flags [P.], seq 79212:79368, ack 37, win 313, length 156
20:38:17.205654 IP 157.245.94.33.22 > 198.96.85.163.26087: Flags [P.], seq 79368:79524, ack 37, win 313, length 156
20:38:17.205734 IP 157.245.94.33.22 > 198.96.85.163.26087: Flags [P.], seq 79524:79680, ack 37, win 313, length 156
20:38:17.205807 IP 157.245.94.33.22 > 198.96.85.163.26087: Flags [P.], seq 79680:79836, ack 37, win 313, length 156
20:38:17.206093 IP 198.96.85.163.26087 > 157.245.94.33.22: Flags [.], ack 65956, win 2051, length 0
20:38:17.206124 IP 157.245.94.33.22 > 198.96.85.163.26087: Flags [P.], seq 79836:79992, ack 37, win 313, length 156
20:38:17.206284 IP 157.245.94.33.22 > 198.96.85.163.26087: Flags [P.], seq 79992:80244, ack 37, win 313, length 252
20:38:17.206405 IP 157.245.94.33.22 > 198.96.85.163.26087: Flags [P.], seq 80244:80400, ack 37, win 313, length 156
20:38:17.206515 IP 157.245.94.33.22 > 198.96.85.163.26087: Flags [P.], seq 80400:80556, ack 37, win 313, length 156
20:38:17.206621 IP 157.245.94.33.22 > 198.96.85.163.26087: Flags [P.], seq 80556:80712, ack 37, win 313, length 156
20:38:17.206741 IP 157.245.94.33.22 > 198.96.85.163.26087: Flags [P.], seq 80712:80868, ack 37, win 313, length 156
20:38:17.206843 IP 157.245.94.33.22 > 198.96.85.163.26087: Flags [P.], seq 80868:81024, ack 37, win 313, length 156
20:38:17.206952 IP 157.245.94.33.22 > 198.96.85.163.26087: Flags [P.], seq 81024:81180, ack 37, win 313, length 156
20:38:17.207061 IP 157.245.94.33.22 > 198.96.85.163.26087: Flags [P.], seq 81180:81336, ack 37, win 313, length 156
20:38:17.207166 IP 157.245.94.33.22 > 198.96.85.163.26087: Flags [P.], seq 81336:81492, ack 37, win 313, length 156
20:38:17.207293 IP 157.245.94.33.22 > 198.96.85.163.26087: Flags [P.], seq 81492:81648, ack 37, win 313, length 156
20:38:17.207574 IP 198.96.85.163.26087 > 157.245.94.33.22: Flags [.], ack 67612, win 2051, length 0
20:38:17.207603 IP 157.245.94.33.22 > 198.96.85.163.26087: Flags [P.], seq 81648:81804, ack 37, win 313, length 156
20:38:17.207739 IP 157.245.94.33.22 > 198.96.85.163.26087: Flags [P.], seq 81804:82056, ack 37, win 313, length 252
20:38:17.207850 IP 157.245.94.33.22 > 198.96.85.163.26087: Flags [P.], seq 82056:82212, ack 37, win 313, length 156
20:38:17.207959 IP 157.245.94.33.22 > 198.96.85.163.26087: Flags [P.], seq 82212:82368, ack 37, win 313, length 156
20:38:17.208063 IP 157.245.94.33.22 > 198.96.85.163.26087: Flags [P.], seq 82368:82524, ack 37, win 313, length 156
20:38:17.208170 IP 157.245.94.33.22 > 198.96.85.163.26087: Flags [P.], seq 82524:82680, ack 37, win 313, length 156
20:38:17.208278 IP 157.245.94.33.22 > 198.96.85.163.26087: Flags [P.], seq 82680:82836, ack 37, win 313, length 156
20:38:17.208412 IP 157.245.94.33.22 > 198.96.85.163.26087: Flags [P.], seq 82836:82992, ack 37, win 313, length 156
20:38:17.208537 IP 157.245.94.33.22 > 198.96.85.163.26087: Flags [P.], seq 82992:83148, ack 37, win 313, length 156
20:38:17.208649 IP 157.245.94.33.22 > 198.96.85.163.26087: Flags [P.], seq 83148:83304, ack 37, win 313, length 156
20:38:17.212344 IP 198.96.85.163.26087 > 157.245.94.33.22: Flags [.], ack 68332, win 2048, length 0
20:38:17.212386 IP 157.245.94.33.22 > 198.96.85.163.26087: Flags [P.], seq 83304:83460, ack 37, win 313, length 156
20:38:17.212598 IP 157.245.94.33.22 > 198.96.85.163.26087: Flags [P.], seq 83460:83712, ack 37, win 313, length 252
20:38:17.212748 IP 157.245.94.33.22 > 198.96.85.163.26087: Flags [P.], seq 83712:83868, ack 37, win 313, length 156
20:38:17.212868 IP 157.245.94.33.22 > 198.96.85.163.26087: Flags [P.], seq 83868:84024, ack 37, win 313, length 156
20:38:17.214022 IP 198.96.85.163.26087 > 157.245.94.33.22: Flags [.], ack 68644, win 2047, length 0
20:38:17.214054 IP 157.245.94.33.22 > 198.96.85.163.26087: Flags [P.], seq 84024:84180, ack 37, win 313, length 156
20:38:17.214260 IP 157.245.94.33.22 > 198.96.85.163.26087: Flags [P.], seq 84180:84432, ack 37, win 313, length 252
20:38:17.218599 IP 198.96.85.163.26087 > 157.245.94.33.22: Flags [.], ack 69468, win 2051, length 0
20:38:17.218646 IP 157.245.94.33.22 > 198.96.85.163.26087: Flags [P.], seq 84432:84588, ack 37, win 313, length 156
20:38:17.218854 IP 157.245.94.33.22 > 198.96.85.163.26087: Flags [P.], seq 84588:84840, ack 37, win 313, length 252
20:38:17.218990 IP 157.245.94.33.22 > 198.96.85.163.26087: Flags [P.], seq 84840:84996, ack 37, win 313, length 156
20:38:17.219096 IP 157.245.94.33.22 > 198.96.85.163.26087: Flags [P.], seq 84996:85152, ack 37, win 313, length 156
20:38:17.219558 IP 198.96.85.163.26087 > 157.245.94.33.22: Flags [.], ack 71748, win 2051, length 0
20:38:17.219607 IP 157.245.94.33.22 > 198.96.85.163.26087: Flags [P.], seq 85152:85308, ack 37, win 313, length 156
20:38:17.219852 IP 157.245.94.33.22 > 198.96.85.163.26087: Flags [P.], seq 85308:85560, ack 37, win 313, length 252
20:38:17.219980 IP 157.245.94.33.22 > 198.96.85.163.26087: Flags [P.], seq 85560:85716, ack 37, win 313, length 156
20:38:17.220092 IP 157.245.94.33.22 > 198.96.85.163.26087: Flags [P.], seq 85716:85872, ack 37, win 313, length 156
20:38:17.220156 IP 198.96.85.163.26087 > 157.245.94.33.22: Flags [.], ack 73812, win 2051, length 0
20:38:17.220404 IP 157.245.94.33.22 > 198.96.85.163.26087: Flags [P.], seq 85872:86124, ack 37, win 313, length 252
20:38:17.220591 IP 157.245.94.33.22 > 198.96.85.163.26087: Flags [P.], seq 86124:86280, ack 37, win 313, length 156
20:38:17.220772 IP 157.245.94.33.22 > 198.96.85.163.26087: Flags [P.], seq 86280:86436, ack 37, win 313, length 156
20:38:17.220931 IP 157.245.94.33.22 > 198.96.85.163.26087: Flags [P.], seq 86436:86592, ack 37, win 313, length 156
20:38:17.221044 IP 157.245.94.33.22 > 198.96.85.163.26087: Flags [P.], seq 86592:86748, ack 37, win 313, length 156
20:38:17.221148 IP 157.245.94.33.22 > 198.96.85.163.26087: Flags [P.], seq 86748:86904, ack 37, win 313, length 156
20:38:17.221315 IP 157.245.94.33.22 > 198.96.85.163.26087: Flags [P.], seq 86904:87060, ack 37, win 313, length 156
20:38:17.221492 IP 157.245.94.33.22 > 198.96.85.163.26087: Flags [P.], seq 87060:87216, ack 37, win 313, length 156
20:38:17.221629 IP 157.245.94.33.22 > 198.96.85.163.26087: Flags [P.], seq 87216:87372, ack 37, win 313, length 156
20:38:17.221766 IP 157.245.94.33.22 > 198.96.85.163.26087: Flags [P.], seq 87372:87528, ack 37, win 313, length 156
20:38:17.221858 IP 198.96.85.163.26087 > 157.245.94.33.22: Flags [.], ack 76308, win 2051, length 0
20:38:17.221968 IP 157.245.94.33.22 > 198.96.85.163.26087: Flags [P.], seq 87528:87780, ack 37, win 313, length 252
20:38:17.222073 IP 157.245.94.33.22 > 198.96.85.163.26087: Flags [P.], seq 87780:87936, ack 37, win 313, length 156
20:38:17.222171 IP 157.245.94.33.22 > 198.96.85.163.26087: Flags [P.], seq 87936:88092, ack 37, win 313, length 156
20:38:17.222341 IP 157.245.94.33.22 > 198.96.85.163.26087: Flags [P.], seq 88092:88248, ack 37, win 313, length 156
20:38:17.222457 IP 157.245.94.33.22 > 198.96.85.163.26087: Flags [P.], seq 88248:88404, ack 37, win 313, length 156
20:38:17.222561 IP 157.245.94.33.22 > 198.96.85.163.26087: Flags [P.], seq 88404:88560, ack 37, win 313, length 156
20:38:17.222660 IP 157.245.94.33.22 > 198.96.85.163.26087: Flags [P.], seq 88560:88716, ack 37, win 313, length 156
20:38:17.222769 IP 157.245.94.33.22 > 198.96.85.163.26087: Flags [P.], seq 88716:88872, ack 37, win 313, length 156
20:38:17.222891 IP 157.245.94.33.22 > 198.96.85.163.26087: Flags [P.], seq 88872:89028, ack 37, win 313, length 156
20:38:17.222997 IP 157.245.94.33.22 > 198.96.85.163.26087: Flags [P.], seq 89028:89184, ack 37, win 313, length 156
20:38:17.223095 IP 157.245.94.33.22 > 198.96.85.163.26087: Flags [P.], seq 89184:89340, ack 37, win 313, length 156
20:38:17.223193 IP 157.245.94.33.22 > 198.96.85.163.26087: Flags [P.], seq 89340:89496, ack 37, win 313, length 156
20:38:17.223290 IP 157.245.94.33.22 > 198.96.85.163.26087: Flags [P.], seq 89496:89652, ack 37, win 313, length 156
20:38:17.223411 IP 157.245.94.33.22 > 198.96.85.163.26087: Flags [P.], seq 89652:89808, ack 37, win 313, length 156
20:38:17.223609 IP 157.245.94.33.22 > 198.96.85.163.26087: Flags [P.], seq 89808:89964, ack 37, win 313, length 156
20:38:17.223747 IP 157.245.94.33.22 > 198.96.85.163.26087: Flags [P.], seq 89964:90120, ack 37, win 313, length 156
20:38:17.223851 IP 157.245.94.33.22 > 198.96.85.163.26087: Flags [P.], seq 90120:90276, ack 37, win 313, length 156
20:38:17.223950 IP 157.245.94.33.22 > 198.96.85.163.26087: Flags [P.], seq 90276:90432, ack 37, win 313, length 156
20:38:17.224047 IP 157.245.94.33.22 > 198.96.85.163.26087: Flags [P.], seq 90432:90588, ack 37, win 313, length 156
20:38:17.224145 IP 157.245.94.33.22 > 198.96.85.163.26087: Flags [P.], seq 90588:90744, ack 37, win 313, length 156
20:38:17.224243 IP 157.245.94.33.22 > 198.96.85.163.26087: Flags [P.], seq 90744:90900, ack 37, win 313, length 156
20:38:17.224340 IP 157.245.94.33.22 > 198.96.85.163.26087: Flags [P.], seq 90900:91056, ack 37, win 313, length 156
20:38:17.224437 IP 157.245.94.33.22 > 198.96.85.163.26087: Flags [P.], seq 91056:91212, ack 37, win 313, length 156
20:38:17.224535 IP 157.245.94.33.22 > 198.96.85.163.26087: Flags [P.], seq 91212:91368, ack 37, win 313, length 156
20:38:17.224632 IP 157.245.94.33.22 > 198.96.85.163.26087: Flags [P.], seq 91368:91524, ack 37, win 313, length 156
20:38:17.224730 IP 157.245.94.33.22 > 198.96.85.163.26087: Flags [P.], seq 91524:91680, ack 37, win 313, length 156
20:38:17.224829 IP 157.245.94.33.22 > 198.96.85.163.26087: Flags [P.], seq 91680:91836, ack 37, win 313, length 156
20:38:17.224926 IP 157.245.94.33.22 > 198.96.85.163.26087: Flags [P.], seq 91836:91992, ack 37, win 313, length 156
20:38:17.225751 IP 198.96.85.163.26087 > 157.245.94.33.22: Flags [.], ack 79836, win 2051, length 0
20:38:17.225795 IP 157.245.94.33.22 > 198.96.85.163.26087: Flags [P.], seq 91992:92148, ack 37, win 313, length 156
20:38:17.225993 IP 157.245.94.33.22 > 198.96.85.163.26087: Flags [P.], seq 92148:92400, ack 37, win 313, length 252
20:38:17.226078 IP 157.245.94.33.22 > 198.96.85.163.26087: Flags [P.], seq 92400:92556, ack 37, win 313, length 156
20:38:17.226154 IP 157.245.94.33.22 > 198.96.85.163.26087: Flags [P.], seq 92556:92712, ack 37, win 313, length 156
20:38:17.226220 IP 198.96.85.163.26087 > 157.245.94.33.22: Flags [.], ack 80868, win 2047, length 0
20:38:17.226311 IP 157.245.94.33.22 > 198.96.85.163.26087: Flags [P.], seq 92712:92964, ack 37, win 313, length 252
20:38:17.226392 IP 157.245.94.33.22 > 198.96.85.163.26087: Flags [P.], seq 92964:93120, ack 37, win 313, length 156
20:38:17.226496 IP 157.245.94.33.22 > 198.96.85.163.26087: Flags [P.], seq 93120:93276, ack 37, win 313, length 156
20:38:17.226578 IP 157.245.94.33.22 > 198.96.85.163.26087: Flags [P.], seq 93276:93432, ack 37, win 313, length 156
20:38:17.226652 IP 157.245.94.33.22 > 198.96.85.163.26087: Flags [P.], seq 93432:93588, ack 37, win 313, length 156
20:38:17.226730 IP 157.245.94.33.22 > 198.96.85.163.26087: Flags [P.], seq 93588:93744, ack 37, win 313, length 156
20:38:17.226807 IP 157.245.94.33.22 > 198.96.85.163.26087: Flags [P.], seq 93744:93900, ack 37, win 313, length 156
20:38:17.226895 IP 157.245.94.33.22 > 198.96.85.163.26087: Flags [P.], seq 93900:94056, ack 37, win 313, length 156
20:38:17.226981 IP 157.245.94.33.22 > 198.96.85.163.26087: Flags [P.], seq 94056:94212, ack 37, win 313, length 156
20:38:17.227067 IP 157.245.94.33.22 > 198.96.85.163.26087: Flags [P.], seq 94212:94368, ack 37, win 313, length 156
20:38:17.227142 IP 157.245.94.33.22 > 198.96.85.163.26087: Flags [P.], seq 94368:94524, ack 37, win 313, length 156
20:38:17.227224 IP 157.245.94.33.22 > 198.96.85.163.26087: Flags [P.], seq 94524:94680, ack 37, win 313, length 156
20:38:17.227300 IP 157.245.94.33.22 > 198.96.85.163.26087: Flags [P.], seq 94680:94836, ack 37, win 313, length 156
20:38:17.227377 IP 157.245.94.33.22 > 198.96.85.163.26087: Flags [P.], seq 94836:94992, ack 37, win 313, length 156
20:38:17.227453 IP 157.245.94.33.22 > 198.96.85.163.26087: Flags [P.], seq 94992:95148, ack 37, win 313, length 156
20:38:17.227530 IP 157.245.94.33.22 > 198.96.85.163.26087: Flags [P.], seq 95148:95304, ack 37, win 313, length 156
20:38:17.227609 IP 157.245.94.33.22 > 198.96.85.163.26087: Flags [P.], seq 95304:95460, ack 37, win 313, length 156
20:38:17.227687 IP 157.245.94.33.22 > 198.96.85.163.26087: Flags [P.], seq 95460:95616, ack 37, win 313, length 156
20:38:17.227761 IP 157.245.94.33.22 > 198.96.85.163.26087: Flags [P.], seq 95616:95772, ack 37, win 313, length 156
20:38:17.227838 IP 157.245.94.33.22 > 198.96.85.163.26087: Flags [P.], seq 95772:95928, ack 37, win 313, length 156
20:38:17.227925 IP 157.245.94.33.22 > 198.96.85.163.26087: Flags [P.], seq 95928:96084, ack 37, win 313, length 156
20:38:17.228002 IP 157.245.94.33.22 > 198.96.85.163.26087: Flags [P.], seq 96084:96240, ack 37, win 313, length 156
20:38:17.228076 IP 157.245.94.33.22 > 198.96.85.163.26087: Flags [P.], seq 96240:96396, ack 37, win 313, length 156
20:38:17.228153 IP 157.245.94.33.22 > 198.96.85.163.26087: Flags [P.], seq 96396:96552, ack 37, win 313, length 156
20:38:17.228236 IP 198.96.85.163.26087 > 157.245.94.33.22: Flags [.], ack 83304, win 2051, length 0
20:38:17.228297 IP 157.245.94.33.22 > 198.96.85.163.26087: Flags [P.], seq 96552:96708, ack 37, win 313, length 156
20:38:17.228393 IP 157.245.94.33.22 > 198.96.85.163.26087: Flags [P.], seq 96708:96960, ack 37, win 313, length 252
20:38:17.228509 IP 157.245.94.33.22 > 198.96.85.163.26087: Flags [P.], seq 96960:97116, ack 37, win 313, length 156
20:38:17.228602 IP 157.245.94.33.22 > 198.96.85.163.26087: Flags [P.], seq 97116:97272, ack 37, win 313, length 156
20:38:17.228681 IP 157.245.94.33.22 > 198.96.85.163.26087: Flags [P.], seq 97272:97428, ack 37, win 313, length 156
20:38:17.228788 IP 157.245.94.33.22 > 198.96.85.163.26087: Flags [P.], seq 97428:97584, ack 37, win 313, length 156
20:38:17.228873 IP 157.245.94.33.22 > 198.96.85.163.26087: Flags [P.], seq 97584:97740, ack 37, win 313, length 156
20:38:17.228965 IP 157.245.94.33.22 > 198.96.85.163.26087: Flags [P.], seq 97740:97896, ack 37, win 313, length 156
20:38:17.229046 IP 157.245.94.33.22 > 198.96.85.163.26087: Flags [P.], seq 97896:98052, ack 37, win 313, length 156
20:38:17.229171 IP 157.245.94.33.22 > 198.96.85.163.26087: Flags [P.], seq 98052:98208, ack 37, win 313, length 156
20:38:17.229338 IP 157.245.94.33.22 > 198.96.85.163.26087: Flags [P.], seq 98208:98364, ack 37, win 313, length 156
20:38:17.229482 IP 157.245.94.33.22 > 198.96.85.163.26087: Flags [P.], seq 98364:98520, ack 37, win 313, length 156
20:38:17.229624 IP 157.245.94.33.22 > 198.96.85.163.26087: Flags [P.], seq 98520:98676, ack 37, win 313, length 156
20:38:17.229764 IP 157.245.94.33.22 > 198.96.85.163.26087: Flags [P.], seq 98676:98832, ack 37, win 313, length 156
20:38:17.229899 IP 157.245.94.33.22 > 198.96.85.163.26087: Flags [P.], seq 98832:98988, ack 37, win 313, length 156
20:38:17.231957 IP 198.96.85.163.26087 > 157.245.94.33.22: Flags [.], ack 84024, win 2048, length 0
20:38:17.231985 IP 157.245.94.33.22 > 198.96.85.163.26087: Flags [P.], seq 98988:99144, ack 37, win 313, length 156
20:38:17.232182 IP 157.245.94.33.22 > 198.96.85.163.26087: Flags [P.], seq 99144:99396, ack 37, win 313, length 252
20:38:17.232262 IP 198.96.85.163.26087 > 157.245.94.33.22: Flags [P.], seq 37:73, ack 84024, win 2048, length 36
20:38:17.232409 IP 157.245.94.33.22 > 198.96.85.163.26087: Flags [P.], seq 99396:99664, ack 73, win 313, length 268
20:38:17.232504 IP 157.245.94.33.22 > 198.96.85.163.26087: Flags [P.], seq 99664:99820, ack 73, win 313, length 156
20:38:17.233833 IP 198.96.85.163.26087 > 157.245.94.33.22: Flags [.], ack 84432, win 2047, length 0
20:38:17.233858 IP 157.245.94.33.22 > 198.96.85.163.26087: Flags [P.], seq 99820:99976, ack 73, win 313, length 156
20:38:17.234012 IP 157.245.94.33.22 > 198.96.85.163.26087: Flags [P.], seq 99976:100228, ack 73, win 313, length 252
20:38:17.239566 IP 198.96.85.163.26087 > 157.245.94.33.22: Flags [.], ack 85152, win 2051, length 0
20:38:17.239607 IP 157.245.94.33.22 > 198.96.85.163.26087: Flags [P.], seq 100228:100384, ack 73, win 313, length 156
20:38:17.239765 IP 157.245.94.33.22 > 198.96.85.163.26087: Flags [P.], seq 100384:100644, ack 73, win 313, length 260
20:38:17.239848 IP 157.245.94.33.22 > 198.96.85.163.26087: Flags [P.], seq 100644:100800, ack 73, win 313, length 156
20:38:17.239953 IP 157.245.94.33.22 > 198.96.85.163.26087: Flags [P.], seq 100800:100956, ack 73, win 313, length 156
20:38:17.240029 IP 157.245.94.33.22 > 198.96.85.163.26087: Flags [P.], seq 100956:101112, ack 73, win 313, length 156
20:38:17.246084 IP 198.96.85.163.26087 > 157.245.94.33.22: Flags [.], ack 89652, win 2051, length 0
20:38:17.246175 IP 157.245.94.33.22 > 198.96.85.163.26087: Flags [P.], seq 101112:101268, ack 73, win 313, length 156
20:38:17.246205 IP 198.96.85.163.26087 > 157.245.94.33.22: Flags [.], ack 91992, win 2051, length 0
20:38:17.246226 IP 198.96.85.163.26087 > 157.245.94.33.22: Flags [.], ack 92712, win 2048, length 0
20:38:17.246541 IP 157.245.94.33.22 > 198.96.85.163.26087: Flags [P.], seq 101268:101728, ack 73, win 313, length 460
20:38:17.246674 IP 157.245.94.33.22 > 198.96.85.163.26087: Flags [P.], seq 101728:101884, ack 73, win 313, length 156
20:38:17.246792 IP 157.245.94.33.22 > 198.96.85.163.26087: Flags [P.], seq 101884:102040, ack 73, win 313, length 156
20:38:17.246909 IP 157.245.94.33.22 > 198.96.85.163.26087: Flags [P.], seq 102040:102196, ack 73, win 313, length 156
20:38:17.247012 IP 157.245.94.33.22 > 198.96.85.163.26087: Flags [P.], seq 102196:102352, ack 73, win 313, length 156
20:38:17.247118 IP 157.245.94.33.22 > 198.96.85.163.26087: Flags [P.], seq 102352:102508, ack 73, win 313, length 156
20:38:17.247232 IP 157.245.94.33.22 > 198.96.85.163.26087: Flags [P.], seq 102508:102664, ack 73, win 313, length 156
20:38:17.247326 IP 157.245.94.33.22 > 198.96.85.163.26087: Flags [P.], seq 102664:102820, ack 73, win 313, length 156
20:38:17.247415 IP 157.245.94.33.22 > 198.96.85.163.26087: Flags [P.], seq 102820:102976, ack 73, win 313, length 156
20:38:17.247500 IP 157.245.94.33.22 > 198.96.85.163.26087: Flags [P.], seq 102976:103132, ack 73, win 313, length 156
20:38:17.247585 IP 157.245.94.33.22 > 198.96.85.163.26087: Flags [P.], seq 103132:103288, ack 73, win 313, length 156
20:38:17.247674 IP 198.96.85.163.26087 > 157.245.94.33.22: Flags [.], ack 96552, win 2051, length 0
20:38:17.247762 IP 157.245.94.33.22 > 198.96.85.163.26087: Flags [P.], seq 103288:103444, ack 73, win 313, length 156
20:38:17.247869 IP 157.245.94.33.22 > 198.96.85.163.26087: Flags [P.], seq 103444:103704, ack 73, win 313, length 260
20:38:17.247970 IP 157.245.94.33.22 > 198.96.85.163.26087: Flags [P.], seq 103704:103860, ack 73, win 313, length 156
20:38:17.248072 IP 157.245.94.33.22 > 198.96.85.163.26087: Flags [P.], seq 103860:104016, ack 73, win 313, length 156
20:38:17.248185 IP 157.245.94.33.22 > 198.96.85.163.26087: Flags [P.], seq 104016:104172, ack 73, win 313, length 156
20:38:17.248301 IP 157.245.94.33.22 > 198.96.85.163.26087: Flags [P.], seq 104172:104328, ack 73, win 313, length 156
20:38:17.248416 IP 157.245.94.33.22 > 198.96.85.163.26087: Flags [P.], seq 104328:104484, ack 73, win 313, length 156
20:38:17.248521 IP 157.245.94.33.22 > 198.96.85.163.26087: Flags [P.], seq 104484:104640, ack 73, win 313, length 156
20:38:17.248623 IP 157.245.94.33.22 > 198.96.85.163.26087: Flags [P.], seq 104640:104796, ack 73, win 313, length 156
20:38:17.248720 IP 157.245.94.33.22 > 198.96.85.163.26087: Flags [P.], seq 104796:104952, ack 73, win 313, length 156
20:38:17.248822 IP 157.245.94.33.22 > 198.96.85.163.26087: Flags [P.], seq 104952:105108, ack 73, win 313, length 156
20:38:17.248927 IP 157.245.94.33.22 > 198.96.85.163.26087: Flags [P.], seq 105108:105264, ack 73, win 313, length 156
20:38:17.249037 IP 157.245.94.33.22 > 198.96.85.163.26087: Flags [P.], seq 105264:105420, ack 73, win 313, length 156
20:38:17.249158 IP 157.245.94.33.22 > 198.96.85.163.26087: Flags [P.], seq 105420:105576, ack 73, win 313, length 156
20:38:17.249303 IP 157.245.94.33.22 > 198.96.85.163.26087: Flags [P.], seq 105576:105732, ack 73, win 313, length 156
20:38:17.249422 IP 157.245.94.33.22 > 198.96.85.163.26087: Flags [P.], seq 105732:105888, ack 73, win 313, length 156
20:38:17.249536 IP 157.245.94.33.22 > 198.96.85.163.26087: Flags [P.], seq 105888:106044, ack 73, win 313, length 156
20:38:17.249606 IP 198.96.85.163.26087 > 157.245.94.33.22: Flags [.], ack 98988, win 2051, length 0
20:38:17.249766 IP 157.245.94.33.22 > 198.96.85.163.26087: Flags [P.], seq 106044:106304, ack 73, win 313, length 260
20:38:17.249910 IP 157.245.94.33.22 > 198.96.85.163.26087: Flags [P.], seq 106304:106460, ack 73, win 313, length 156
20:38:17.250046 IP 157.245.94.33.22 > 198.96.85.163.26087: Flags [P.], seq 106460:106616, ack 73, win 313, length 156
20:38:17.250179 IP 157.245.94.33.22 > 198.96.85.163.26087: Flags [P.], seq 106616:106772, ack 73, win 313, length 156
20:38:17.250356 IP 157.245.94.33.22 > 198.96.85.163.26087: Flags [P.], seq 106772:106928, ack 73, win 313, length 156
20:38:17.250494 IP 157.245.94.33.22 > 198.96.85.163.26087: Flags [P.], seq 106928:107084, ack 73, win 313, length 156
20:38:17.250619 IP 157.245.94.33.22 > 198.96.85.163.26087: Flags [P.], seq 107084:107240, ack 73, win 313, length 156
20:38:17.250747 IP 157.245.94.33.22 > 198.96.85.163.26087: Flags [P.], seq 107240:107396, ack 73, win 313, length 156
20:38:17.250877 IP 157.245.94.33.22 > 198.96.85.163.26087: Flags [P.], seq 107396:107552, ack 73, win 313, length 156
20:38:17.251009 IP 157.245.94.33.22 > 198.96.85.163.26087: Flags [P.], seq 107552:107708, ack 73, win 313, length 156
20:38:17.251145 IP 157.245.94.33.22 > 198.96.85.163.26087: Flags [P.], seq 107708:107864, ack 73, win 313, length 156
20:38:17.251285 IP 157.245.94.33.22 > 198.96.85.163.26087: Flags [P.], seq 107864:108020, ack 73, win 313, length 156
20:38:17.251416 IP 157.245.94.33.22 > 198.96.85.163.26087: Flags [P.], seq 108020:108176, ack 73, win 313, length 156
20:38:17.251540 IP 157.245.94.33.22 > 198.96.85.163.26087: Flags [P.], seq 108176:108332, ack 73, win 313, length 156
20:38:17.251667 IP 157.245.94.33.22 > 198.96.85.163.26087: Flags [P.], seq 108332:108488, ack 73, win 313, length 156
20:38:17.251799 IP 157.245.94.33.22 > 198.96.85.163.26087: Flags [P.], seq 108488:108644, ack 73, win 313, length 156
20:38:17.251889 IP 198.96.85.163.26087 > 157.245.94.33.22: Flags [.], ack 99820, win 2048, length 0
20:38:17.252026 IP 157.245.94.33.22 > 198.96.85.163.26087: Flags [P.], seq 108644:108904, ack 73, win 313, length 260
20:38:17.252193 IP 157.245.94.33.22 > 198.96.85.163.26087: Flags [P.], seq 108904:109060, ack 73, win 313, length 156
20:38:17.252343 IP 157.245.94.33.22 > 198.96.85.163.26087: Flags [P.], seq 109060:109216, ack 73, win 313, length 156
20:38:17.252491 IP 157.245.94.33.22 > 198.96.85.163.26087: Flags [P.], seq 109216:109372, ack 73, win 313, length 156
20:38:17.252640 IP 157.245.94.33.22 > 198.96.85.163.26087: Flags [P.], seq 109372:109528, ack 73, win 313, length 156
20:38:17.252786 IP 157.245.94.33.22 > 198.96.85.163.26087: Flags [P.], seq 109528:109684, ack 73, win 313, length 156
20:38:17.252928 IP 157.245.94.33.22 > 198.96.85.163.26087: Flags [P.], seq 109684:109840, ack 73, win 313, length 156
20:38:17.253066 IP 157.245.94.33.22 > 198.96.85.163.26087: Flags [P.], seq 109840:109996, ack 73, win 313, length 156
20:38:17.253222 IP 157.245.94.33.22 > 198.96.85.163.26087: Flags [P.], seq 109996:110152, ack 73, win 313, length 156
20:38:17.253367 IP 157.245.94.33.22 > 198.96.85.163.26087: Flags [P.], seq 110152:110308, ack 73, win 313, length 156
20:38:17.253502 IP 157.245.94.33.22 > 198.96.85.163.26087: Flags [P.], seq 110308:110464, ack 73, win 313, length 156
20:38:17.253643 IP 157.245.94.33.22 > 198.96.85.163.26087: Flags [P.], seq 110464:110620, ack 73, win 313, length 156
20:38:17.253784 IP 157.245.94.33.22 > 198.96.85.163.26087: Flags [P.], seq 110620:110776, ack 73, win 313, length 156
20:38:17.253810 IP 198.96.85.163.26087 > 157.245.94.33.22: Flags [.], ack 100228, win 2046, length 0
20:38:17.253990 IP 157.245.94.33.22 > 198.96.85.163.26087: Flags [P.], seq 110776:111036, ack 73, win 313, length 260
20:38:17.254136 IP 157.245.94.33.22 > 198.96.85.163.26087: Flags [P.], seq 111036:111192, ack 73, win 313, length 156
20:38:17.254319 IP 157.245.94.33.22 > 198.96.85.163.26087: Flags [P.], seq 111192:111348, ack 73, win 313, length 156
20:38:17.254471 IP 157.245.94.33.22 > 198.96.85.163.26087: Flags [P.], seq 111348:111504, ack 73, win 313, length 156
20:38:17.254610 IP 157.245.94.33.22 > 198.96.85.163.26087: Flags [P.], seq 111504:111660, ack 73, win 313, length 156
20:38:17.254759 IP 157.245.94.33.22 > 198.96.85.163.26087: Flags [P.], seq 111660:111816, ack 73, win 313, length 156
20:38:17.254908 IP 157.245.94.33.22 > 198.96.85.163.26087: Flags [P.], seq 111816:111972, ack 73, win 313, length 156
20:38:17.255050 IP 157.245.94.33.22 > 198.96.85.163.26087: Flags [P.], seq 111972:112128, ack 73, win 313, length 156
20:38:17.255189 IP 157.245.94.33.22 > 198.96.85.163.26087: Flags [P.], seq 112128:112284, ack 73, win 313, length 156
20:38:17.255281 IP 157.245.94.33.22 > 198.96.85.163.26087: Flags [P.], seq 112284:112440, ack 73, win 313, length 156
20:38:17.255428 IP 157.245.94.33.22 > 198.96.85.163.26087: Flags [P.], seq 112440:112596, ack 73, win 313, length 156
20:38:17.255531 IP 157.245.94.33.22 > 198.96.85.163.26087: Flags [P.], seq 112596:112752, ack 73, win 313, length 156
20:38:17.255675 IP 157.245.94.33.22 > 198.96.85.163.26087: Flags [P.], seq 112752:112908, ack 73, win 313, length 156
20:38:17.255780 IP 157.245.94.33.22 > 198.96.85.163.26087: Flags [P.], seq 112908:113064, ack 73, win 313, length 156
20:38:17.255903 IP 157.245.94.33.22 > 198.96.85.163.26087: Flags [P.], seq 113064:113220, ack 73, win 313, length 156
20:38:17.255992 IP 157.245.94.33.22 > 198.96.85.163.26087: Flags [P.], seq 113220:113376, ack 73, win 313, length 156
20:38:17.256112 IP 157.245.94.33.22 > 198.96.85.163.26087: Flags [P.], seq 113376:113532, ack 73, win 313, length 156
20:38:17.256274 IP 157.245.94.33.22 > 198.96.85.163.26087: Flags [P.], seq 113532:113688, ack 73, win 313, length 156
20:38:17.256391 IP 157.245.94.33.22 > 198.96.85.163.26087: Flags [P.], seq 113688:113844, ack 73, win 313, length 156
20:38:17.256540 IP 157.245.94.33.22 > 198.96.85.163.26087: Flags [P.], seq 113844:114000, ack 73, win 313, length 156
20:38:17.256636 IP 157.245.94.33.22 > 198.96.85.163.26087: Flags [P.], seq 114000:114156, ack 73, win 313, length 156
20:38:17.256719 IP 157.245.94.33.22 > 198.96.85.163.26087: Flags [P.], seq 114156:114312, ack 73, win 313, length 156
20:38:17.256800 IP 157.245.94.33.22 > 198.96.85.163.26087: Flags [P.], seq 114312:114468, ack 73, win 313, length 156
20:38:17.256881 IP 157.245.94.33.22 > 198.96.85.163.26087: Flags [P.], seq 114468:114624, ack 73, win 313, length 156
20:38:17.256962 IP 157.245.94.33.22 > 198.96.85.163.26087: Flags [P.], seq 114624:114780, ack 73, win 313, length 156
20:38:17.257044 IP 157.245.94.33.22 > 198.96.85.163.26087: Flags [P.], seq 114780:114936, ack 73, win 313, length 156
20:38:17.257180 IP 157.245.94.33.22 > 198.96.85.163.26087: Flags [P.], seq 114936:115092, ack 73, win 313, length 156
20:38:17.257290 IP 157.245.94.33.22 > 198.96.85.163.26087: Flags [P.], seq 115092:115248, ack 73, win 313, length 156
20:38:17.257378 IP 157.245.94.33.22 > 198.96.85.163.26087: Flags [P.], seq 115248:115404, ack 73, win 313, length 156
20:38:17.257492 IP 157.245.94.33.22 > 198.96.85.163.26087: Flags [P.], seq 115404:115560, ack 73, win 313, length 156
20:38:17.257586 IP 157.245.94.33.22 > 198.96.85.163.26087: Flags [P.], seq 115560:115716, ack 73, win 313, length 156
20:38:17.257668 IP 157.245.94.33.22 > 198.96.85.163.26087: Flags [P.], seq 115716:115872, ack 73, win 313, length 156
20:38:17.257764 IP 157.245.94.33.22 > 198.96.85.163.26087: Flags [P.], seq 115872:116028, ack 73, win 313, length 156
20:38:17.259925 IP 198.96.85.163.26087 > 157.245.94.33.22: Flags [.], ack 101112, win 2051, length 0
20:38:17.259984 IP 157.245.94.33.22 > 198.96.85.163.26087: Flags [P.], seq 116028:116184, ack 73, win 313, length 156
20:38:17.260144 IP 157.245.94.33.22 > 198.96.85.163.26087: Flags [P.], seq 116184:116444, ack 73, win 313, length 260
20:38:17.260282 IP 157.245.94.33.22 > 198.96.85.163.26087: Flags [P.], seq 116444:116600, ack 73, win 313, length 156
20:38:17.260370 IP 157.245.94.33.22 > 198.96.85.163.26087: Flags [P.], seq 116600:116756, ack 73, win 313, length 156
20:38:17.260455 IP 157.245.94.33.22 > 198.96.85.163.26087: Flags [P.], seq 116756:116912, ack 73, win 313, length 156
20:38:17.266410 IP 198.96.85.163.26087 > 157.245.94.33.22: Flags [P.], seq 73:109, ack 101268, win 2050, length 36
20:38:17.266462 IP 157.245.94.33.22 > 198.96.85.163.26087: Flags [P.], seq 116912:117068, ack 109, win 313, length 156
^C
767 packets captured
780 packets received by filter
13 packets dropped by kernel
