root@lamp-s-1vcpu-1gb-nyc1-01:~# tcpdump -c 5 -i eth0
tcpdump: verbose output suppressed, use -v or -vv for full protocol decode
listening on eth0, link-type EN10MB (Ethernet), capture size 262144 bytes
20:27:17.881676 IP lamp-s-1vcpu-1gb-nyc1-01.ssh > 198.96.85.163.26087: Flags [P.], seq 3964134367:3964134475, ack 643402058, win 313, length 108
20:27:17.881749 IP lamp-s-1vcpu-1gb-nyc1-01.ssh > 198.96.85.163.26087: Flags [P.], seq 108:144, ack 1, win 313, length 36
20:27:17.881817 IP lamp-s-1vcpu-1gb-nyc1-01.ssh > 198.96.85.163.26087: Flags [P.], seq 144:252, ack 1, win 313, length 108
20:27:17.881867 IP lamp-s-1vcpu-1gb-nyc1-01.ssh > 198.96.85.163.26087: Flags [P.], seq 252:288, ack 1, win 313, length 36
20:27:17.883299 IP lamp-s-1vcpu-1gb-nyc1-01.ssh > 198.96.85.163.26087: Flags [P.], seq 288:468, ack 1, win 313, length 180
5 packets captured
9 packets received by filter
0 packets dropped by kernel
